ticker,company,headline,datetime
KMT,Kennametal Inc.,Kennametal (KMT) Reports Q3 Earnings: What Key Metrics Have to Say,1715175028.0
KMT,Kennametal Inc.,Kennametal Inc. (KMT) Fiscal Q3 2024 Earnings: Aligns with Analyst EPS Projections Amidst ...,1715169759.0
KMT,Kennametal Inc.,Kennametal Inc. (KMT) Q3 2024 Earnings Call Transcript,1715168724.0
KMT,Kennametal Inc.,Kennametal (KMT) Q3 Earnings and Revenues Miss Estimates,1715168405.0
KMT,Kennametal Inc.,Kennametal Announces Fiscal 2024 Third Quarter Results,1715164200.0
KMT,Kennametal Inc.,Kennametal: Fiscal Q3 Earnings Snapshot,1715150475.0
KNSL,"Kinsale Capital Group, Inc.",Kinsale's Outlook Remains Strong Despite Slowing Growth,1715154802.0
KNSL,"Kinsale Capital Group, Inc.",Kinsale Capital Group: Right Multiple For Growing Insurer,1715148138.0
KO,The Coca-Cola Company,Carlos Pagoaga to be Named President of The Coca-Cola Foundation,1715180400.0
KO,The Coca-Cola Company,VDC: Strong and Steady Consumer Staples ETF,1715142505.0
KODK,Eastman Kodak Company,The meme stock surge doesn't appear to be the ominous signal it has been,1715162443.0
KOS,Kosmos Energy Ltd.,Kosmos Energy First Quarter 2024 Earnings: EPS Beats Expectations,1715165702.0
KOS,Kosmos Energy Ltd.,Kosmos Energy Ltd (KOS) (Q1 2024) Earnings Call Transcript Highlights: Strategic Advances and ...,1715154096.0
KOS,Kosmos Energy Ltd.,Q1 2024 Kosmos Energy Ltd Earnings Call,1715144530.0
KSS,Kohl's Corporation,Kohl : Oh Baby! Here’s the List of Kohl’s Stores Getting a Babies“R”Us Shop This Year,1715155811.0
KTB,"Kontoor Brands, Inc.",Kontoor Brands (KTB) Price Target Increased by 13.30% to 74.46,1715188514.0
KVUE,Kenvue Inc.,4 Dividend Aristocrats To Buy In May Plus 4 To Watch,1715169884.0
KVUE,Kenvue Inc.,Kenvue Inc call volume above normal and directionally bullish,1715160300.0
KVUE,Kenvue Inc.,"Kenvue price target raised by $1 at HSBC, here's why",1715150760.0
KVUE,Kenvue Inc.,"Kenvue, Inc.: Strong Q1 Performance and Strategic Cost Savings Signal Positive Outlook",1715150160.0
KVUE,Kenvue Inc.,30 Cheap Large Cap Stocks On Sale Now For May 2024,1715147742.0
KVUE,Kenvue Inc.,"New Buy Rating for Kenvue, Inc. (KVUE), the Technology Giant",1715146740.0
KVUE,Kenvue Inc.,"Analysts Offer Insights on Technology Companies: Kenvue, Inc. (KVUE), Uber Technologies (UBER) and Toast Inc (TOST)",1715145720.0
KVUE,Kenvue Inc.,Outperforming Expectations: Buy Rating Affirmed for Kenvue Inc. Amidst Strong Q1 Results and Positive 2024 Outlook,1715145660.0
KVUE,Kenvue Inc.,"Kenvue, Inc.: Hold Rating Maintained Amid Mixed Performance and Ongoing Challenges",1715145360.0
KVUE,Kenvue Inc.,Kenvue Inc (KVUE) Q1 2024 Earnings Call Transcript Highlights: Strategic Growth and Operational ...,1715131560.0
LAZ,Lazard Ltd,"Lazard Pres. talks markets, AI energy needs, election risks",1715184318.0
LCII,LCI Industries,LCI Industries 2024 Q1 - Results - Earnings Call Presentation,1715181471.0
LCII,LCI Industries,LCI Industries (LCII) Q1 2024 Earnings Call Transcript,1715181431.0
LCII,LCI Industries,"LCII Stock Earnings: LCI Indus Beats EPS, Beats Revenue for Q1 2024",1715165880.0
LCII,LCI Industries,"Louisiana-Pacific Posts Upbeat Results, Joins Cricut, Elanco Animal, American Public Education And Other Big Stocks Moving Higher On Wednesday",1715163180.0
LCII,LCI Industries,LCI Industries Inc (LCII) Surpasses Analyst Earnings Projections in Q1 2024,1715153700.0
LCII,LCI Industries,LCI: Q1 Earnings Snapshot,1715152112.0
LCII,LCI Industries,LCI Industries Reports First Quarter Financial Results,1715151665.0
LCII,LCI Industries,"LCI GAAP EPS of $1.44 beats by $0.92, revenue of $968M beats by $7.48M",1715149440.0
LCII,LCI Industries,LCI Industries reports Q1  EPS $1.44 consensus 52c,1715148600.0
LDI,"loanDepot, Inc.",LoanDepot : 1Q24 Earnings Transcript,1715167992.0
LDI,"loanDepot, Inc.",loanDepot (LDI) Q1 2024 Earnings Call Transcript,1715157017.0
LDOS,"Leidos Holdings, Inc.",Leidos Holdings (LDOS) Price Target Increased by 12.16% to 162.24,1715147418.0
LEG,"Leggett & Platt, Incorporated",LEGGETT & PLATT ANNOUNCES ANNUAL MEETING RESULTS,1715167027.0
LEN,Lennar Corporation,Home builders’ stocks have soared since we said they were cheap. These five are expected to grow profits rapidly through 2025.,1715160480.0
LEVI,Levi Strauss & Co.,Levi’s Voting Initiative Targets Community College Students,1715184000.0
LH,Laboratory Corporation of America Holdings,Labcorp to Webcast Its Annual Meeting of Shareholders,1715165940.0
LH,Laboratory Corporation of America Holdings,Q1 2024 OPKO Health Inc Earnings Call,1715165801.0
LH,Laboratory Corporation of America Holdings,OPKO Health Inc (OPK) Q1 2024 Earnings Call Transcript Highlights: Strategic Moves Amid ...,1715154269.0
LHX,"L3Harris Technologies, Inc.",L3HARRIS IS ADVANCING THE FUTURE FLEET BY DELIVERING INTEGRATED SOLUTIONS,1715164762.0
LL,"LL Flooring Holdings, Inc.",LL Flooring Reports First Quarter 2024 Financial Results,1715162400.0
LL,"LL Flooring Holdings, Inc.","LL Flooring Holdings, Inc. (LL) Q1 2024 Earnings Call Transcript",1715162281.0
LMT,Lockheed Martin Corporation,10 Weakest Militaries in Africa,1715132901.0
LNC,Lincoln National Corporation,SHAREHOLDER ACTION NOTICE: The Schall Law Firm Encourages Investors in Lincoln National Corporation with Losses to Contact the Firm,1715165168.0
LNC,Lincoln National Corporation,"Lincoln National Corporation Sued for Securities Law Violations - Investors Should Contact Levi & Korsinsky Before June 24, 2024 to Discuss Your Rights - LNC",1715147180.0
LOB,"Live Oak Bancshares, Inc.",YieldBoost Live Oak Bancshares From 0.3% To 11.5% Using Options,1715164980.0
LPX,Louisiana-Pacific Corporation,Louisiana-Pacific Corporation 2024 Q1 - Results - Earnings Call Presentation,1715170236.0
LPX,Louisiana-Pacific Corporation,Louisiana-Pacific Corp Surpasses Q1 2024 Earnings Estimates with Robust Siding and OSB Sales,1715167956.0
LPX,Louisiana-Pacific Corporation,Louisiana-Pacific (LPX) Tops Q1 Earnings and Revenue Estimates,1715166603.0
LPX,Louisiana-Pacific Corporation,A Look At The Fair Value Of Louisiana-Pacific Corporation (NYSE:LPX),1715165728.0
LPX,Louisiana-Pacific Corporation,"Tranche Update on Louisiana-Pacific Corporation's Equity Buyback Plan announced on May 3, 2022.",1715162820.0
LPX,Louisiana-Pacific Corporation,Louisiana-Pacific Corporation announces an Equity Buyback for $250 million worth of its shares.,1715162820.0
LPX,Louisiana-Pacific Corporation,LP Building Solutions Reports First Quarter 2024 Results and Increases Second Quarter and Full Year Outlook for 2024,1715162400.0
LPX,Louisiana-Pacific Corporation,Louisiana-Pacific: Q1 Earnings Snapshot,1715151072.0
LTH,"Life Time Group Holdings, Inc.","Tennis Grand Slam Champion Andre Agassi, and Top-Rated Pickleball Pros, Serve Up High Competition at Life Time PENN 1 in New York City",1715181187.0
LUMN,"Lumen Technologies, Inc.",Lumen Technologies (LUMN) Price Target Decreased by 6.80% to 1.55,1715131716.0
LUV,Southwest Airlines Co.,SHOWCASING HEART FOR PEOPLE AND PLANET: SOUTHWEST AIRLINES REPORTS ANNUAL PROGRESS IN SUSTAINABILITY AND CORPORATE CITIZENSHIP,1715175187.0
LUV,Southwest Airlines Co.,Southwest’s Preboarding Line Is Out of Control,1715130000.0
LVS,Las Vegas Sands Corp.,"Las Vegas Sands Extends Funding To Dress for Success Southern Nevada With a $100,000 Sands Cares Donation",1715141588.0
LYB,LyondellBasell Industries N.V.,UPDATE 1-LyondellBasell weighs strategic options for European assets,1715178786.0
LYB,LyondellBasell Industries N.V.,LyondellBasell Weighs Strategic Options for European Assets,1715176800.0
LYG,Lloyds Banking Group plc,UK dividends calendar,1715165340.0
LYG,Lloyds Banking Group plc,BOE PREVIEW: May hold expected but June cut conviction builds,1715155140.0
LYG,Lloyds Banking Group plc,Lloyds Director Takes Role at Man Group plc,1715149920.0
LYV,"Live Nation Entertainment, Inc.","Live Nation Entertainment : NCT DREAM Reveal 2024 NCT DREAM WORLD TOUR Latin America, U.S., And Europe Tour Details",1715180711.0
LYV,"Live Nation Entertainment, Inc.",The Gap Between the Price You See and What You Pay Is Getting Worse,1715130000.0
M,"Macy's, Inc.",The Battle for Macy's,1715176802.0
M,"Macy's, Inc.",These 2 Retail-Wholesale Stocks Could Beat Earnings: Why They Should Be on Your Radar,1715173205.0
MA,Mastercard Incorporated,Fans are following Taylor Swift to Europe after finding Eras Tour tickets less costly there,1715133743.0
MAA,"Mid-America Apartment Communities, Inc.",Camden Property Trust: Higher Home Costs And Strong Fundamentals Make Long-Term Buy,1715151600.0
MAC,The Macerich Company,Macerich (MAC) Price Target Decreased by 6.09% to 15.72,1715150291.0
MAIN,Main Street Capital Corporation,Ares Capital's Q1 Has Important Ramifications For The BDC Sector,1715173778.0
MAIN,Main Street Capital Corporation,Stellus Capital: High Monthly Income But Trades At A Premium,1715169383.0
MAIN,Main Street Capital Corporation,2 BDCs Yielding Above 11% That Have Below Average Risk Profile,1715154561.0
MAN,ManpowerGroup Inc.,Will Top-Line Improvement Aid GigaCloud's (GCT) Q1 Earnings?,1715184900.0
MATX,"Matson, Inc.",Insider Sale: Senior Vice President Leonard Isotoff Sells Shares of Matson Inc (MATX),1715171100.0
MAX,"MediaAlpha, Inc.",MediaAlpha First Quarter 2024 Earnings: Beats Expectations,1715168663.0
MAX,"MediaAlpha, Inc.",MediaAlpha Announces Pricing of Secondary Offering by White Mountains Insurance Group and Insignia Capital Group,1715128140.0
MBC,"MasterBrand, Inc.",Q1 2024 MasterBrand Inc Earnings Call,1715163288.0
MBC,"MasterBrand, Inc.",MasterBrand Inc (MBC) Q1 2024 Earnings Call Transcript Highlights: Navigating Challenges with ...,1715155082.0
MBC,"MasterBrand, Inc.",Loop Capital Markets Reaffirms Their Buy Rating on MasterBrand Inc (MBC),1715150820.0
MBC,"MasterBrand, Inc.",MasterBrand Releases Investor Presentation for Upcoming Discussions,1715148840.0
MCD,McDonald's Corporation,McDonald's India franchisee Westlife's Q4 profit slumps on frail demand,1715145804.0
MCK,McKesson Corporation,McKesson Corporation (NYSE:MCK) Q4 2024 Earnings Call Transcript,1715181320.0
MCK,McKesson Corporation,McKesson Corp (MCK) Q4 2024 Earnings Call Transcript Highlights: Strong Growth and Strategic ...,1715154372.0
MCK,McKesson Corporation,30 Cheap Large Cap Stocks On Sale Now For May 2024,1715147742.0
MCK,McKesson Corporation,McKesson (MCK) Q4 2024 Earnings Call Transcript,1715129117.0
MCY,Mercury General Corporation,Mercury General (MCY) Price Target Increased by 18.18% to 66.30,1715183021.0
MDT,Medtronic plc,4 Dividend Aristocrats To Buy In May Plus 4 To Watch,1715169884.0
MEG,"Montrose Environmental Group, Inc.",Montrose Environmental (MEG) Q1 Earnings: Taking a Look at Key Metrics Versus Estimates,1715126407.0
MFC,Manulife Financial Corporation,Manulife Releases 2023 Sustainability Report and Public Accountability Statement,1715171460.0
MFC,Manulife Financial Corporation,Standard Chartered and Olea Global partner to aid SME growth,1715167042.0
MFC,Manulife Financial Corporation,Front Street Re Appoints Edison Fong as Chief Executive Officer,1715160120.0
MHO,"M/I Homes, Inc.","Zacks.com featured highlights include M/I Homes, Minerals Technologies, GMS, YPF Sociedad Anonima and ADT",1715158260.0
MLM,"Martin Marietta Materials, Inc.",ALBEMARLE AND MARTIN MARIETTA SIGN INNOVATIVE AGREEMENT FOR BENEFICIAL USE OF MATERIAL FROM KINGS MOUNTAIN MINE,1715165400.0
MLNK,"MeridianLink, Inc.",MeridianLink Inc (MLNK) Q1 2024 Earnings Call Transcript Highlights: Navigating Market ...,1715156166.0
MMI,"Marcus & Millichap, Inc.",Marcus & Millichap : First Quarter 2024 Earnings Conference Call Presentation,1715156410.0
MMI,"Marcus & Millichap, Inc.","Marcus & Millichap, Inc. Reports Results for First Quarter 2024",1715155268.0
MMM,3M Company,4 Dividend Aristocrats To Buy In May Plus 4 To Watch,1715169884.0
MO,"Altria Group, Inc.","Altria Offers Compelling Dividends, Despite Growth Risks",1715176800.0
MO,"Altria Group, Inc.",British American Tobacco Isn't Dead Money As Pessimism Peaks,1715170937.0
MO,"Altria Group, Inc.",30 Cheap Large Cap Stocks On Sale Now For May 2024,1715147742.0
MPC,Marathon Petroleum Corporation,30 Cheap Large Cap Stocks On Sale Now For May 2024,1715147742.0
MPX,Marine Products Corporation,Exploring Top Dividend Stocks For May 2024,1715152389.0
MRC,MRC Global Inc.,UK dividends calendar,1715165340.0
MRK,"Merck & Co., Inc.",Merck Expands Access to High-Quality Maternal Care for More Than 30 Million Women Worldwide Through Merck for Mothers,1715174100.0
MRK,"Merck & Co., Inc.",Q1 2024 OPKO Health Inc Earnings Call,1715165801.0
MRK,"Merck & Co., Inc.",Merck to Participate in the Bank of America Securities 2024 Healthcare Conference,1715165100.0
MRO,Marathon Oil Corporation,Diamondback (FANG) Q1 Earnings Beat Estimates as Output Jumps,1715178720.0
MRO,Marathon Oil Corporation,Are Oils-Energy Stocks Lagging  Marathon Oil (MRO) This Year?,1715175610.0
MS,Morgan Stanley,Morgan Stanley (MS) Could Be a Great Choice,1715183106.0
MS,Morgan Stanley,Oil Declines With US Stockpiles and Mideast Tensions in Focus,1715133203.0
MS,Morgan Stanley,Morgan Stanley expects Fed to cut interest rates for first time in September,1715169673.0
MS,Morgan Stanley,3 Tech Stock Darlings to Scoop Up After Q2 earnings,1715150040.0
MS,Morgan Stanley,Morgan Stanley pushes Fed rate cut expectation to September from July,1715128718.0
MSCI,MSCI Inc.,Is Most-Watched Stock MSCI Inc (MSCI) Worth Betting on Now?,1715173211.0
MSCI,MSCI Inc.,Is iShares Paris-Aligned Climate MSCI USA ETF (PABU) a Strong ETF Right Now?,1715163606.0
MSI,"Motorola Solutions, Inc.","It's Unlikely That Motorola Solutions, Inc.'s (NYSE:MSI) CEO Will See A Huge Pay Rise This Year",1715163835.0
MTG,MGIC Investment Corporation,"Assurant (AIZ) Q1 Earnings & Revenues Beat Estimates, Rise Y/Y",1715170260.0
MTH,Meritage Homes Corporation,KBW Sticks to Its Hold Rating for Meritage (MTH),1715171160.0
MTW,"The Manitowoc Company, Inc.","The Manitowoc Company, Inc. (MTW) Q1 2024 Earnings Call Transcript",1715174230.0
MTW,"The Manitowoc Company, Inc.","The Manitowoc Company, Inc. 2024 Q1 - Results - Earnings Call Presentation",1715168006.0
MTW,"The Manitowoc Company, Inc.",Analysts Offer Insights on Industrial Goods Companies: Upwork (UPWK) and Manitowoc Company (MTW),1715146260.0
MTZ,"MasTec, Inc.",MasTec (MTZ) Price Target Increased by 17.11% to 118.71,1715155114.0
MUR,Murphy Oil Corporation,Murphy Oil: Stronger Free Cash Flow and Strategic Initiatives Justify Buy Rating,1715138220.0
MUSA,Murphy USA Inc.,7 Stocks to Buy Before the Next ‘Great Reset’ Begins in 2024,1715144760.0
MWA,"Mueller Water Products, Inc.","Mueller Water Products, Inc. (MWA) Q2 2024 Earnings Call Transcript Highlights: Strong Growth ...",1715153813.0
MX,Magnachip Semiconductor Corporation,Magnachip Semiconductor (MX) Price Target Decreased by 20.00% to 8.16,1715159810.0
MYE,"Myers Industries, Inc.",Myers Industries Inc (MYE) Q1 2024 Earnings Call Transcript Highlights: Navigating Challenges ...,1715152130.0
MYE,"Myers Industries, Inc.",Q1 2024 Myers Industries Inc Earnings Call,1715137967.0
NAPA,"The Duckhorn Portfolio, Inc.",Duckhorn Portfolio (NAPA) Price Target Decreased by 7.78% to 10.58,1715131411.0
NAT,Nordic American Tankers Limited,Millionaire Blueprint: 3 Stocks Under $5 With Massive Growth Potential by 2028,1715144460.0
NE,Noble Corporation Plc,Noble Corporation (NYSE:NE) Q1 2024 Earnings Call Transcript,1715178782.0
NE,Noble Corporation Plc,Noble Corp PLC (NE) (Q1 2024) Earnings Call Transcript Highlights: Strong Performance and ...,1715153216.0
NEM,Newmont Corporation,Is Newmont (NEM) Stock Outpacing Its Basic Materials Peers This Year?,1715175610.0
NET,"Cloudflare, Inc.","Cloudflare First Quarter 2024 Earnings: Revenues Beat Expectations, EPS In Line",1715168430.0
NET,"Cloudflare, Inc.","Cloudflare Stock Has 48% Upside, According to 1 Wall Street Analyst",1715163360.0
NET,"Cloudflare, Inc.",Netcall plc Issues New Shares Post-Option Exercise,1715132340.0
NGVC,"Natural Grocers by Vitamin Cottage, Inc.","Natural Grocers® Hosts Fourth Annual Body Care & Beauty Bonanza, May 9-31, 2024",1715167020.0
NGVT,Ingevity Corporation,Ingevity (NGVT) Price Target Increased by 5.20% to 61.93,1715185576.0
NHI,"National Health Investors, Inc.",National Health Investors Inc (NHI) (Q1 2024) Earnings Call Transcript Highlights: A Strong ...,1715154154.0
NHI,"National Health Investors, Inc.",Q1 2024 National Health Investors Inc Earnings Call,1715147025.0
NI,NiSource Inc.,NiSource Inc. (NI) Q1 2024 Earnings Call Transcript,1715177424.0
NI,NiSource Inc.,NiSource Inc. 2024 Q1 - Results - Earnings Call Presentation,1715177399.0
NI,NiSource Inc.,NiSource : Q1 2024 NiSource Earnings Conference Call Supplemental Earnings Slides,1715172428.0
NI,NiSource Inc.,NiSource Inc (NI) Q1 2024 Earnings: Adjusted EPS Beats Estimates Amidst Strategic Growth Initiatives,1715169152.0
NI,NiSource Inc.,NiSource Announces First Quarter 2024 Results,1715164200.0
NI,NiSource Inc.,NiSource : First Quarter 2024 Supplemental Financial Information,1715160439.0
NI,NiSource Inc.,NiSource : First Quarter 2024 Earnings Release,1715159954.0
NI,NiSource Inc.,NiSource: Q1 Earnings Snapshot,1715150831.0
NJR,New Jersey Resources Corporation,New Jersey Resources Corporation (NYSE:NJR) Q2 2024 Earnings Call Transcript,1715183680.0
NJR,New Jersey Resources Corporation,New Jersey Resources Corp (NJR) (Q2 2024) Earnings Call Transcript Highlights: Strong ...,1715153385.0
NJR,New Jersey Resources Corporation,Q2 2024 New Jersey Resources Corp Earnings Call,1715142372.0
NMM,Navios Maritime Partners L.P.,Is Navios Maritime Partners (NMM) Stock Undervalued Right Now?,1715175613.0
NMM,Navios Maritime Partners L.P.,"Navios Maritime Partners LP (NMM) Hit a 52 Week High, Can the Run Continue?",1715174106.0
NMR,"Nomura Holdings, Inc.",Nomura Limits Segantii Exposure on HK Insider Trading Case,1715173156.0
NOK,Nokia Oyj,Nokia 3210 relaunched to mark handset’s 25th anniversary,1715186856.0
NOK,Nokia Oyj,O2 Telefónica and Nokia roll out 5G standalone core on Amazon Web Services in the cloud,1715154120.0
NOW,"ServiceNow, Inc.",Wall Street Analysts See Upside Potential for 10 Stocks with Rising Price Targets,1715186167.0
NOW,"ServiceNow, Inc.",ServiceNow announces an expansion of the strategic relationship with Equinix to streamline operations of digital infrastructure,1715185920.0
NOW,"ServiceNow, Inc.","ServiceNow and Microsoft Expand Strategic Alliance, Combining Generative AI Capabilities to Enhance Choice and Flexibility",1715185860.0
NOW,"ServiceNow, Inc.",ServiceNow and IBM Collaborate to Accelerate the Impact of Generative AI Across the Enterprise,1715185800.0
NOW,"ServiceNow, Inc.",ServiceNow showcases generative AI service agents using NVIDIA AI Enterprise software,1715185800.0
NOW,"ServiceNow, Inc.",ServiceNow Adds Powerful New Solutions to the Now Platform to Transform the Employee Experience and Simplify Work Across the Enterprise,1715185800.0
NPO,Enpro Inc.,"EnPro Industries, Inc. (NYSE:NPO) Q1 2024 Earnings Call Transcript",1715181220.0
NPO,Enpro Inc.,Enpro Inc (NPO) Q1 2024 Earnings Call Transcript Highlights: Navigating Challenges with ...,1715152243.0
NRDY,"Nerdy, Inc.",Gateway Regional School District Announces Partnership with Varsity Tutors for Schools to Provide Live and On-Demand Learning Resources for All Students,1715166000.0
NRDY,"Nerdy, Inc.",Nerdy Inc (NRDY) Q1 2024 Earnings Call Transcript Highlights: Robust Growth and Strategic Expansions,1715156414.0
NRG,"NRG Energy, Inc.","Can NRG Energy, Inc.'s (NYSE:NRG) ROE Continue To Surpass The Industry Average?",1715163275.0
NRG,"NRG Energy, Inc.",NRG Energy Inc (NRG) Q1 2024 Earnings Call Transcript Highlights: A Robust Start with Strategic ...,1715153095.0
NRG,"NRG Energy, Inc.",Q1 2024 NRG Energy Inc Earnings Call,1715138055.0
NRGV,"Energy Vault Holdings, Inc.",Energy Vault Announces Successful Testing and Commissioning of First EVx 100 MWh Gravity Energy Storage System by China Tianying,1715151017.0
NRP,Natural Resource Partners L.P.,Natural Resources Partners LP (NRP) (Q1 2024) Earnings Call Transcript Highlights: Strong Cash ...,1715152957.0
NRP,Natural Resource Partners L.P.,Q1 2024 Natural Resource Partners LP Earnings Call,1715139411.0
NSC,Norfolk Southern Corporation,What the proxy fight at Norfolk Southern means for railroad safety,1715166031.0
NTB,The Bank of N.T. Butterfield & Son Limited,Bank of N T Butterfield & Son : The Bank of Butterfield - Board of Directors Change - Pamela Thomas-Graham,1715168829.0
NTR,Nutrien Ltd.,Here Are 6 Dividend Stocks I'm Buying For A Generational Market Shift,1715151600.0
NU,Nu Holdings Ltd.,Nubank Surpasses 100 Million Customers,1715157187.0
NU,Nu Holdings Ltd.,Nu : Nubank surpasses 100 million customers,1715156888.0
NU,Nu Holdings Ltd.,Nu : Nubank surpasses 100 million customers - Form 6-K,1715155517.0
NU,Nu Holdings Ltd.,Nu Mexico continues its expansion: reaches 7 million customers,1715153467.0
NUE,Nucor Corporation,Calculating The Intrinsic Value Of Nucor Corporation (NYSE:NUE),1715176813.0
NUE,Nucor Corporation,30 Cheap Large Cap Stocks On Sale Now For May 2024,1715147742.0
NVRI,Enviri Corporation,Favourable Signals For Enviri: Numerous Insiders Acquired Stock,1715163409.0
NVRI,Enviri Corporation,F. Grasberger Bought 3.1% More Shares In Enviri,1715162597.0
NVRI,Enviri Corporation,Enviri (NVRI) Price Target Decreased by 5.31% to 13.64,1715154228.0
NVRO,Nevro Corp.,Nevro Corp (NVRO) Q1 2024 Earnings Call Transcript Highlights: A Detailed Review of Financial ...,1715154646.0
NVRO,Nevro Corp.,Nevro Corp. (NVRO) Q1 2024 Earnings Call Transcript,1715133661.0
NVT,nVent Electric plc,nVent Electric (NVT) Price Target Increased by 5.53% to 89.03,1715183048.0
NWG,NatWest Group plc,Up to 300 defence companies debanked by high street lenders,1715144400.0
NX,Quanex Building Products Corporation,Here's Why We Think Quanex Building Products (NYSE:NX) Might Deserve Your Attention Today,1715181211.0
NX,Quanex Building Products Corporation,Is Quanex Building Products (NX) Stock Undervalued Right Now?,1715175614.0
NX,Quanex Building Products Corporation,Best Value Stocks to Buy for May 8th,1715171040.0
NX,Quanex Building Products Corporation,"Form 8.3 - The Vanguard Group, Inc.: Quanex Building Products Corporation",1715163906.0
NXE,NexGen Energy Ltd.,NexGen Energy plunges on dilutive $250M deal for physical uranium,1715158800.0
NXE,NexGen Energy Ltd.,NexGen’s Major Uranium Acquisition Strengthens Market Position,1715151480.0
NXE,NexGen Energy Ltd.,NexGen Energy: Q1 Earnings Snapshot,1715150580.0
NXE,NexGen Energy Ltd.,NexGen Energy’s Asset Growth Amidst Quarterly Loss,1715149920.0
NXE,NexGen Energy Ltd.,NexGen Announces Strategic Purchase of 2.7 Million Pounds of Uranium with Issuance of US$250 Million Convertible Debenture,1715149800.0
NXE,NexGen Energy Ltd.,NexGen’s Strategic Uranium Purchase Boosts Assets,1715148480.0
NXE,NexGen Energy Ltd.,"NexGen Energy purchases 2,702,410 pounds of natural uranium concentrate",1715148360.0
NYCB,"New York Community Bancorp, Inc.","NYCB stock cheapest among US lenders with over $3 billion in assets, S&P Global says",1715181721.0
NYCB,"New York Community Bancorp, Inc.",New York Community Bancorp was the cheapest U.S. bank in April - S&P Global Market Intelligence,1715169600.0
NYCB,"New York Community Bancorp, Inc.",Greenlight Capital Sold New York Community Bancorp (NYCB) in Q1,1715158514.0
NYCB,"New York Community Bancorp, Inc.",Fitch cuts NYCB’s debt rating deeper into junk territory but says outlook remains stable,1715154420.0
NYCB,"New York Community Bancorp, Inc.",Fitch Downgrades New York Community Bancorp to 'BB'; Outlook Stable,1715146231.0
NYT,The New York Times Company,The New York Times Company 2024 Q1 - Results - Earnings Call Presentation,1715177860.0
NYT,The New York Times Company,The New York Times Company (NYT) Q1 2024 Earnings Call Transcript,1715177594.0
NYT,The New York Times Company,New York Times Co (NYT) Q1 2024 Earnings: Surpasses Analyst Revenue Forecasts,1715171662.0
NYT,The New York Times Company,New York Times : Deputy Media Editor,1715171347.0
NYT,The New York Times Company,The New York Times Company Reports First-Quarter 2024 Results,1715166120.0
NYT,The New York Times Company,New York Times : Michal Leibowitz Returns to Times Opinion,1715163909.0
NYT,The New York Times Company,Tracking Misinformation: India’s General Election,1715160547.0
NYT,The New York Times Company,New York Times beats first-quarter revenue estimates,1715151856.0
NYT,The New York Times Company,New York Times : Reports First-Quarter 2024 Results - Form 8-K,1715151849.0
O,Realty Income Corporation,4 Dividend Aristocrats To Buy In May Plus 4 To Watch,1715169884.0
O,Realty Income Corporation,Buy SCHD And These 4 High Yields For A Diversified Retirement Dividend Portfolio,1715156100.0
O,Realty Income Corporation,Realty Income Corp (O) (Q1 2024) Earnings Call Transcript Highlights: Strategic Investments and ...,1715154218.0
O,Realty Income Corporation,Realty Income (O) Q1 2024 Earnings Call Transcript,1715129121.0
OGN,Organon & Co.,Organon Q1 Earnings: Does The $1 Billion Debt Offering Signal Trouble?,1715159425.0
OGN,Organon & Co.,Organon Announces Pricing of $1.0 Billion Senior Notes Offering,1715127600.0
OGS,"ONE Gas, Inc.","ONE Gas, Inc. (NYSE:OGS) Q1 2024 Earnings Call Transcript",1715178136.0
OI,"O-I Glass, Inc.",O-I Glass (OI) Price Target Decreased by 12.77% to 18.59,1715180607.0
OLO,Olo Inc.,Q1 2024 Olo Inc Earnings Call,1715176392.0
OLO,Olo Inc.,Olo (OLO) Q1 2024 Earnings Call Transcript,1715157014.0
OLO,Olo Inc.,Olo Inc (OLO) Q1 2024 Earnings Call Transcript Highlights: Robust Growth and Strategic Advances,1715156098.0
OLO,Olo Inc.,Olo (OLO) Q1 Earnings: Taking a Look at Key Metrics Versus Estimates,1715126406.0
OMC,Omnicom Group Inc.,30 Cheap Large Cap Stocks On Sale Now For May 2024,1715147742.0
