ticker,company,headline,datetime
A,"Agilent Technologies, Inc.","Agilent Technologies, Inc. (NYSE:A) Shares Could Be 20% Below Their Intrinsic Value Estimate",1715173210.0
A,"Agilent Technologies, Inc.",What's in the Offing for Gen Digital (GEN) This Earnings Season?,1715171520.0
AAN,"The Aaron's Company, Inc.",The Aarons Co Inc (AAN) Q1 2024 Earnings Call Transcript Highlights: Navigating Challenges with ...,1715152639.0
ABBV,AbbVie Inc.,Teva Stock Is Powering Ahead as Schizophrenia News Offsets Mixed Earnings,1715175420.0
ABBV,AbbVie Inc.,QULIPTA™ (atogepant) Now Approved by Health Canada for the Preventive Treatment of Chronic Migraine in Adults,1715169600.0
ABBV,AbbVie Inc.,"BofA starts Sutro at buy, cites ovarian cancer drug candidate",1715164440.0
ABBV,AbbVie Inc.,Organon Q1 Earnings: Does The $1 Billion Debt Offering Signal Trouble?,1715159425.0
ABEV,Ambev S.A.,International Wide-Moat Stocks On Sale - The May 2024 Heat Map,1715169717.0
ABT,Abbott Laboratories,"Got $1,000? 3 Dividend Stocks to Buy and Hold Forever",1715166960.0
ABT,Abbott Laboratories,"The Zacks Analyst Blog Highlights Tesla, Johnson & Johnson, Netflix, Abbott and ConocoPhillips",1715163480.0
ACCO,ACCO Brands Corporation,ACCO Brands (ACCO) Price Target Decreased by 5.38% to 10.46,1715157616.0
ACHR,Archer Aviation Inc.,Archer Completes Installation Of High-Volume Battery Pack Manufacturing Line,1715173200.0
ACM,AECOM,AECOM (ACM) Q2 2024 Earnings Call Transcript Highlights: Robust Growth and Strategic Expansion,1715151801.0
ACM,AECOM,AECOM joint venture to deliver the UK National Grid’s Great Grid Upgrade,1715151366.0
ACN,Accenture plc,"Virgin Media O2 Partners with Accenture to Enhance Private 5G Solutions for UK Businesses, Tapping into Estimated Half a Billion Pound UK Market",1715163367.0
ACN,Accenture plc,"Accenture : Virgin Media O2 Partners with Accenture to Enhance Private 5G Solutions for UK Businesses, Tapping into Estimated Half a Billion Pound UK Market",1715162590.0
ADC,Agree Realty Corporation,Buy Rating Affirmed for Agree Realty on Strong Financial Tactics and Market Positioning,1715172960.0
ADC,Agree Realty Corporation,Buy SCHD And These 4 High Yields For A Diversified Retirement Dividend Portfolio,1715156100.0
ADC,Agree Realty Corporation,Lessons Learned: Trust But Verify,1715151600.0
ADC,Agree Realty Corporation,The 3 Most Undervalued REITs to Buy in May 2024,1715145420.0
ADM,Archer-Daniels-Midland Company,30 Cheap Large Cap Stocks On Sale Now For May 2024,1715147742.0
ADNT,Adient plc,Adient (ADNT) Price Target Decreased by 8.77% to 35.83,1715187046.0
ADT,ADT Inc.,"Zacks.com featured highlights include M/I Homes, Minerals Technologies, GMS, YPF Sociedad Anonima and ADT",1715158260.0
AEE,Ameren Corporation,Ameren : Sustainability Presentation,1715133792.0
AEG,Aegon Ltd.,Aegon Ltd. Proposes New Dividend and Governance Changes,1715150100.0
AEG,Aegon Ltd.,Aegon publishes agenda for 2024 Annual General Meeting,1715133600.0
AER,AerCap Holdings N.V.,"CORRECTED-UPDATE 1-AerCap sees tight jetliner market, places big engine order",1715179968.0
AER,AerCap Holdings N.V.,"AerCap sees tight jetliner market, places big engine order",1715165407.0
AER,AerCap Holdings N.V.,"AerCap Holdings N.V. Announces New Engine Order, New Share Repurchase Authorization and First Cash Dividend",1715162400.0
AER,AerCap Holdings N.V.,AerCap orders 150 CFM engines worth about $3 bln,1715150890.0
AES,The AES Corporation,The Challenge Of Powering AI,1715146309.0
AFG,"American Financial Group, Inc.",(AFG) - Analyzing American Finl Gr's Short Interest,1715169000.0
AG,First Majestic Silver Corp.,First Majestic Announces Financial Results for Q1 2024 and Quarterly Dividend Payment,1715166000.0
AGCO,AGCO Corporation,AGCO Agriculture Foundation Partners with The Do More Agriculture Foundation to Support Farmer Mental Health,1715163368.0
AGL,"agilon health, inc.",Agilon Health Inc (AGL) Q1 2024 Earnings Call Transcript Highlights: Robust Growth Amidst ...,1715155074.0
AGL,"agilon health, inc.","Agilon health, inc. Sued for Securities Law Violations - Contact Levi & Korsinsky Before May 20, 2024 to Discuss Your Rights - AGL",1715147181.0
AGO,Assured Guaranty Ltd.,Assured Guaranty Ltd. (AGO) Q1 2024 Earnings Call Transcript,1715163422.0
AGR,"Avangrid, Inc.","Avangrid’s Seventh Innovation Forum Brings Together Top Universities, National Labs and Incubators to Spark Collaboration",1715179625.0
AHH,"Armada Hoffler Properties, Inc.",Notable earnings before Thursday's open,1715168280.0
AHH,"Armada Hoffler Properties, Inc.",Armada Hoffler Properties Q1 Earnings Preview,1715167560.0
AHT,"Ashford Hospitality Trust, Inc.","Ashford Hospitality Trust, Inc. (AHT) Q1 2024 Earnings Call Transcript",1715178728.0
AIN,Albany International Corp.,Albany International (AIN) Price Target Decreased by 5.15% to 105.26,1715157617.0
AIZ,"Assurant, Inc.","Assurant, Inc. (AIZ) Q1 2024 Earnings Call Transcript",1715168168.0
AIZ,"Assurant, Inc.","Assurant, Inc. 2024 Q1 - Results - Earnings Call Presentation",1715163896.0
AIZ,"Assurant, Inc.",Assurant : Q1 for Q1 2024 Investor Presentation 2024,1715152399.0
ALCC,AltC Acquisition Corp.,Largest borrow rate increases among liquid names,1715154300.0
ALCC,AltC Acquisition Corp.,AltC Acquisition Stockholders Approve Major Corporate Changes,1715145240.0
ALE,"ALLETE, Inc.","Kuehn Law Encourages SWAV, ALE, PRFT, and LSAK Investors to Contact Law Firm",1715181188.0
ALIT,"Alight, Inc.",Alight Inc (ALIT) Q1 2024 Earnings: Mixed Results Amid Strategic Shifts,1715173943.0
ALIT,"Alight, Inc.","Alight, Inc. (ALIT) Misses Q1 Earnings and Revenue Estimates",1715172904.0
ALIT,"Alight, Inc.",Alight Reports First Quarter 2024 Results,1715168700.0
ALIT,"Alight, Inc.",Alight Announces Executive Leadership Changes,1715168640.0
ALK,"Alaska Air Group, Inc.",Alaska Airlines launches new way for guests to join the journey to help make air travel more sustainable,1715168182.0
ALLE,Allegion plc,International Wide-Moat Stocks On Sale - The May 2024 Heat Map,1715169717.0
ALX,"Alexander's, Inc.",Alexander's Inc (ALX) Q1 2024 Earnings Call Transcript Highlights: Strategic Moves Amid ...,1715153337.0
AM,Antero Midstream Corporation,Here Are 6 Dividend Stocks I'm Buying For A Generational Market Shift,1715151600.0
AMBC,"Ambac Financial Group, Inc.",Ambac Financial Group Inc (AMBC) (Q1 2024) Earnings Call Transcript Highlights: Strong Growth ...,1715152201.0
AMBC,"Ambac Financial Group, Inc.",Q1 2024 Ambac Financial Group Inc Earnings Call,1715137812.0
AMCR,Amcor plc,5 Stocks at the Forefront of S&P 500 ETF's Latest Rally,1715179980.0
AMCR,Amcor plc,4 Dividend Aristocrats To Buy In May Plus 4 To Watch,1715169884.0
AMCR,Amcor plc,Amcor launches Bottles of the Year programme,1715161299.0
AME,"AMETEK, Inc.",Ametek: Sustained Growth Model At A Slightly High Price,1715158366.0
AMH,American Homes 4 Rent,"Analysts Offer Insights on Real Estate Companies: Apple Hospitality REIT (APLE), National Storage Affiliates (NSA) and American Homes (AMH)",1715142060.0
AMRC,"Ameresco, Inc.","Ameresco, Inc. (NYSE:AMRC) Q1 2024 Earnings Call Transcript",1715184749.0
AMRC,"Ameresco, Inc.",12 Industrials Stocks Moving In Wednesday's Intraday Session,1715168220.0
AMRC,"Ameresco, Inc.",What's Driving Ameresco Inc's Surprising 27% Stock Rally?,1715163420.0
AMRC,"Ameresco, Inc.","Louisiana-Pacific Posts Upbeat Results, Joins Cricut, Elanco Animal, American Public Education And Other Big Stocks Moving Higher On Wednesday",1715163180.0
AMRC,"Ameresco, Inc.",Ameresco Inc (AMRC) Q1 2024 Earnings Call Transcript Highlights: Robust Growth and Strategic ...,1715154561.0
AMRC,"Ameresco, Inc.","Analysts Are Bullish on These Industrial Goods Stocks: Ameresco (AMRC), CryoPort (CYRX)",1715150460.0
AMRC,"Ameresco, Inc.",Piper Sandler Remains a Buy on Ameresco (AMRC),1715148540.0
ANET,"Arista Networks, Inc.",Arista Earnings Beat Amid New Buyback. Revenue Guidance Hiked.,1715180929.0
ANET,"Arista Networks, Inc.","Bandwidth (BAND) Q1 Earnings Beat, 2024 Guidance Raised",1715175780.0
ANET,"Arista Networks, Inc.","Aspen (AZPN) Q3 Earnings & Revenues Surpass Estimates, Up Y/Y",1715174940.0
ANET,"Arista Networks, Inc.","Palantir, Arista Networks, Microsoft, and Other Tech Stocks in Focus Today",1715174640.0
ANET,"Arista Networks, Inc.","Dow Jones Futures: Uber, Shopify Dive On Earnings But Three Stocks Flash Buy Signals",1715170369.0
ANET,"Arista Networks, Inc.",Arista (ANET) Beats Q1 Earnings Estimates on Solid Revenues,1715169480.0
ANET,"Arista Networks, Inc.","Dow Jones Futures: Reddit, AI Plays Lead Stock Market Earnings Movers",1715166105.0
ANET,"Arista Networks, Inc.","Dow Jones Futures Rise; Reddit, AI Plays Lead Earnings Movers",1715164485.0
ANET,"Arista Networks, Inc.","These Stocks Are Moving the Most Today: Reddit, Lyft, Uber, Rivian, Arista Networks, DoubleVerify, Twilio, and More",1715160120.0
ANET,"Arista Networks, Inc.",Arista Networks Inc (ANET) Q1 2024 Earnings Call Transcript Highlights: Strong Performance and ...,1715154748.0
ANET,"Arista Networks, Inc.",Dow Jones Futures: Market Rally Holds Recent Gains; Reddit Leads Earnings Movers Late,1715116245.0
ANET,"Arista Networks, Inc.",Arista Networks (ANET) Q1 2024 Earnings Call Transcript,1715127313.0
AON,Aon plc,$2.8M Bet On Aon? Check Out These 3 Stocks Insiders Are Buying,1715148000.0
AORT,"Artivion, Inc.","Shareholders Will Probably Hold Off On Increasing Artivion, Inc.'s (NYSE:AORT) CEO Compensation For The Time Being",1715170726.0
AORT,"Artivion, Inc.",Artivion (AORT) Price Target Increased by 11.09% to 27.28,1715138177.0
APD,"Air Products and Chemicals, Inc.",3 Dividend Stocks That Are Coiled Springs for a Lifetime of Passive Income,1715163300.0
APH,Amphenol Corporation,AIM WINNERS & LOSERS: Mobile Tornado wins deal; boohoo loss widens,1715147040.0
APH,Amphenol Corporation,Alliance Pharma Welcomes New CEO for Growth,1715133600.0
APH,Amphenol Corporation,Alliance Pharma Delays Preliminary Results Announcement,1715133060.0
APH,Amphenol Corporation,"GET READY: Alliance Pharma, boohoo, JD Wetherspoon, OSB at 0700 BST",1715132100.0
APO,"Apollo Global Management, Inc.",Ares Capital's Q1 Has Important Ramifications For The BDC Sector,1715173778.0
APTV,Aptiv PLC,Aptiv: Revolutionizing The Automotive Industry With Mobility-Oriented Technology,1715153460.0
AQN,Algonquin Power & Utilities Corp.,NiSource (NI) Tops Q1 Earnings Estimates,1715169002.0
ARE,"Alexandria Real Estate Equities, Inc.",2 Top-Tier REITs You Can Buy At Big Discounts,1715152543.0
ARES,Ares Management Corporation,Ares Capital's Q1 Has Important Ramifications For The BDC Sector,1715173778.0
ARES,Ares Management Corporation,TD Cowen Initiates Coverage of Ares Management (ARES) with Buy Recommendation,1715139148.0
ARI,"Apollo Commercial Real Estate Finance, Inc.",Apollo Commercial Real Estate Finance (ARI) Price Target Decreased by 6.15% to 10.37,1715184894.0
ARIS,"Aris Water Solutions, Inc.","Aris Water Solutions, Inc. (ARIS) Q1 2024 Earnings Call Transcript",1715173027.0
ARIS,"Aris Water Solutions, Inc.","Aris Water Solutions, Inc. 2024 Q2 - Results - Earnings Call Presentation",1715168857.0
ARIS,"Aris Water Solutions, Inc.","Aris Water jumps to 18-month high on earnings, dividend hike",1715167560.0
ARIS,"Aris Water Solutions, Inc.",Stock Market Crash: 3 Must-Buy Penny Stocks When Prices Plunge,1715131320.0
ARIS,"Aris Water Solutions, Inc.","VST, WAVE, ARIS, and GNE are among utility movers",1715130900.0
ARMK,Aramark,Aramark Hosts First International Innovation Summit in Santiago,1715167800.0
ARMK,Aramark,Q1 2024 Abcellera Biologics Inc Earnings Call,1715166067.0
ARMK,Aramark,Aramark (ARMK) Q2 2024 Earnings Call Transcript Highlights: Record Revenues and Robust Growth,1715152323.0
ARW,"Arrow Electronics, Inc.",Arrow Electronics Supports Local Youth Through Colorado Rockies Sponsorship,1715175900.0
ASB,Associated Banc-Corp,Associated Banc : Bank Adds Chun Schiros as Chief Analytics Officer to Help Lead Data and AI Innovation,1715165466.0
ASH,Ashland Inc.,Ashland (ASH) is a Top-Ranked Momentum Stock: Should You Buy?,1715176210.0
ATGE,Adtalem Global Education Inc.,Adtalem Global Education (ATGE) Price Target Increased by 5.13% to 69.70,1715173184.0
ATHM,Autohome Inc.,"Autohome, Inc. (ATHM) Q1 2024 Earnings Call Transcript",1715167929.0
ATHM,Autohome Inc.,"Autohome Inc. Announces 2024 Q1 Earnings:  Record Strong Growth in NEV Business and Echo with ""Trade-in for new"" Policy",1715164920.0
ATHM,Autohome Inc.,Autohome Inc. Announces Unaudited First Quarter 2024 Financial Results,1715160600.0
ATHM,Autohome Inc.,Autohome : First Quarter 2024 Financial Results,1715147467.0
ATI,ATI Inc.,ATI (ATI) Price Target Increased by 14.69% to 66.81,1715157380.0
ATKR,Atkore Inc.,Atkore Inc. (NYSE:ATKR) Q2 2024 Earnings Call Transcript,1715189750.0
ATKR,Atkore Inc.,Atkore Inc (ATKR) Q2 2024 Earnings Call Transcript Highlights: Strong Performance Amid Market ...,1715151981.0
ATKR,Atkore Inc.,Q2 2024 Atkore Inc Earnings Call,1715136943.0
ATUS,"Altice USA, Inc.",Altice USA : News 12 to Host NYC Mayor Eric Adams for Call-In Show,1715162828.0
ATUS,"Altice USA, Inc.",Altice USA (ATUS) Price Target Decreased by 9.88% to 3.20,1715131416.0
AVA,Avista Corporation,Avista Foundation Announces First Quarter Grants,1715174766.0
AVNT,Avient Corporation,Avient First Quarter 2024 Earnings: EPS: US$0.54 (vs US$0.23 in 1Q 2023),1715163062.0
AVNT,Avient Corporation,Avient Corp (AVNT) Q1 2024 Earnings Call Transcript Highlights: Strong Start with Robust EPS ...,1715151817.0
AWK,"American Water Works Company, Inc.",Illinois American Water’s 2023 Water Quality Reports Available Online,1715155266.0
AWR,American States Water Company,American States Water Company 2024 Q1 - Results - Earnings Call Presentation,1715176874.0
AWR,American States Water Company,American States Water : Financial Results Call Presentation First Quarter 2024,1715176507.0
AWR,American States Water Company,Revisiting My 7 Stock Picks From Last Year: How Did I Do?,1715144760.0
AX,"Axos Financial, Inc.",USA TODAY Blueprint Names Axos Bank Among Industry’s Best For Its Checking Account,1715191620.0
AXL,"American Axle & Manufacturing Holdings, Inc.",American Axle (AXL) Q1 Earnings & Sales Surpass Estimates,1715164800.0
AXP,American Express Company,Dow Jones Futures Fall As Uber Dives On Surprise Loss; Tesla Slides On Autopilot Probe,1715170905.0
AXTA,Axalta Coating Systems Ltd.,Axalta Coating Systems (AXTA) Price Target Increased by 7.38% to 40.14,1715181672.0
AZO,"AutoZone, Inc.","Estimating The Intrinsic Value Of AutoZone, Inc. (NYSE:AZO)",1715169623.0
BA,The Boeing Company,News Highlights : Top Company News of the Day - Wednesday at 1 PM ET,1715174187.0
BA,The Boeing Company,"FedEx Airlines, Boeing-made plane forced to land in Istanbul without front wheels",1715174150.0
BA,The Boeing Company,"Israel Must Protect Civilians In Rafah, US Defense Secretary Says After Halted Weapons Shipment",1715168220.0
BA,The Boeing Company,Boeing CFO Brian West to Speak at Wolfe Research Global Transportation & Industrials Conference May 23,1715166069.0
BA,The Boeing Company,"Boeing Cargo Plane's Daring Gearless Landing In Istanbul, Investigation Underway",1715165220.0
BA,The Boeing Company,UPDATE 3-Probe launched after Boeing cargo plane lands in Istanbul without front landing gear,1715161547.0
BA,The Boeing Company,"Boeing cargo plane lands in Istanbul without front landing gear, no casualties",1715159441.0
BA,The Boeing Company,A FedEx cargo plane lands at Istanbul Airport without front landing gear,1715158800.0
BA,The Boeing Company,"Lululemon initiated, Block upgraded: Wall Street's top analyst calls",1715157600.0
BA,The Boeing Company,"Spirit AeroSystems price target raised by $2 at RBC Capital, here's why",1715156340.0
BA,The Boeing Company,Spirit AeroSystems Holdings Inc (SPR) (Q1 2024) Earnings Call Transcript Highlights: Navigating ...,1715153858.0
BA,The Boeing Company,Q1 2024 Allegiant Travel Co Earnings Call,1715152573.0
BA,The Boeing Company,Korean Air sells five jets to U.S. aerospace firm Sierra Nevada,1715147010.0
BA,The Boeing Company,"Wells Fargo upgrades Hexcel to Overweight, raises price target to $95",1715146260.0
BA,The Boeing Company,7 Stocks to Buy Now or Regret It for the Next Decade,1715144460.0
BA,The Boeing Company,Boeing 787 Program Chief Lauds Employee For Speaking Up On Quality Checks: 'Doing The Right Thing',1715142600.0
BA,The Boeing Company,Boeing Starliner crewed mission postponed to May 17,1715134980.0
BA,The Boeing Company,"Boeing Starliner Delays Continue: Crewed Flight Test To Occur No Earlier Than May 17, Says NASA",1715133000.0
BA,The Boeing Company,UPDATE 2- Crewed flight of Boeing Starliner space capsule pushed back at least 10 more days,1715129789.0
BABA,Alibaba Group Holding Limited,"Hong Kong to launch weekly options for stocks including HSBC, Alibaba",1715173874.0
BABA,Alibaba Group Holding Limited,3 Ridiculously Undervalued Stocks to Buy Hand Over Fist Right Now in May,1715160600.0
BABA,Alibaba Group Holding Limited,"Tencent, Alibaba Earnings Are Key to Longer China Stock Rally",1715154433.0
BAC,Bank of America Corporation,SPY: Growing Signs The Market Is Overbought,1715178406.0
BAC,Bank of America Corporation,Are Finance Stocks Lagging  Bank of America (BAC) This Year?,1715175609.0
BAC,Bank of America Corporation,Bank of America survey reveals most small businesses expect revenue growth,1715173811.0
BAC,Bank of America Corporation,Q1 2024 Dutch Bros Inc Earnings Call,1715169564.0
BAC,Bank of America Corporation,Q3 2024 Aspen Technology Inc Earnings Call,1715165661.0
BAC,Bank of America Corporation,"Bank of America : President, International, Bernard Mensah at Barclays Americas Select Franchise Conference",1715156173.0
BAH,Booz Allen Hamilton Holding Corporation,Booz Allen to Provide AI and ML Expertise to Support EPA Scientific Missions,1715155385.0
BAK,Braskem S.A.,Adnoc’s Scrapped Deal Spells End of Braskem Bond Rally,1715181427.0
BAK,Braskem S.A.,Braskem S.A. Affirms SEC Reporting Compliance,1715149800.0
BAM,Brookfield Asset Management Ltd.,Brookfield Asset Management Ltd. (BAM) Q1 2024 Earnings Call Transcript,1715176685.0
BAM,Brookfield Asset Management Ltd.,Ares Capital's Q1 Has Important Ramifications For The BDC Sector,1715173778.0
BAM,Brookfield Asset Management Ltd.,Brookfield: I'm Staying Long Ahead Of Q1 Earnings,1715171262.0
BAM,Brookfield Asset Management Ltd.,"BAM Stock Earnings: Brookfield Asset Mgmt Misses EPS, Misses Revenue for Q1 2024",1715162220.0
BAM,Brookfield Asset Management Ltd.,Brookfield Asset Management declares $0.38 dividend,1715157000.0
BAM,Brookfield Asset Management Ltd.,Brookfield Asset Management : Q1 2024 Letter to Shareholders,1715151132.0
BAM,Brookfield Asset Management Ltd.,Brookfield Asset Management Announces Strong First Quarter Results,1715150717.0
BAM,Brookfield Asset Management Ltd.,"Brookfield Asset Management Q1 results reflect flagship, PE, insurance fee growth",1715150160.0
BAM,Brookfield Asset Management Ltd.,Brookfield Announces Impressive Q1 Growth,1715149620.0
BAM,Brookfield Asset Management Ltd.,Brookfield’s Dynamic Start to 2024 with Capital Surge,1715148480.0
BAM,Brookfield Asset Management Ltd.,"Brookfield Asset Management DE per share of $0.34 in-line, revenue of $884M",1715147700.0
BAM,Brookfield Asset Management Ltd.,"Brookfield Asset Management reports Q1 distributable EPS 34c, consensus 34c",1715147400.0
BANC,"Banc of California, Inc.",Banc of California Hires Ann DeVries as Head of Investor Relations,1715180645.0
BAX,Baxter International Inc.,"Baxter International First Quarter 2024 Earnings: Revenues Beat Expectations, EPS Lags",1715166846.0
BAX,Baxter International Inc.,"Baxter International: Shares Too Cheap, EPS Growth Ahead With A Possible Spinoff",1715149285.0
BB,BlackBerry Limited,"BlackBerry Expands Cybersecurity Curriculum in Malaysia with New Partner, CompTIA",1715130000.0
BBWI,"Bath & Body Works, Inc.","Sally Beauty: A Deep-Value Winner, Nobody Is Talking About",1715162400.0
BBWI,"Bath & Body Works, Inc.",Bath & Body Works Recognizes Associates With Inclusion Excellence Awards,1715141347.0
BBY,"Best Buy Co., Inc.",UK shareholder meetings calendar - next 7 days,1715165700.0
BBY,"Best Buy Co., Inc.","UK earnings, trading statements calendar - next 7 days",1715165520.0
BBY,"Best Buy Co., Inc.",UK dividends calendar,1715165340.0
BBY,"Best Buy Co., Inc.",Balfour Beatty Advances Share Buyback Program,1715133180.0
BCC,Boise Cascade Company,Boise Cascade Co (BCC) (Q1 2024) Earnings Call Transcript Highlights: Strong Performance with ...,1715153942.0
BCC,Boise Cascade Company,Q1 2024 Boise Cascade Co Earnings Call,1715145057.0
BCO,The Brink's Company,Brink's (BCO) Q1 Earnings and Revenues Top Estimates,1715171406.0
BCO,The Brink's Company,The Brink's Company 2024 Q1 - Results - Earnings Call Presentation,1715167348.0
BCO,The Brink's Company,The Brink's Company (BCO) Q1 2024 Earnings Call Transcript,1715167266.0
BCO,The Brink's Company,Brink's Announces Strong First-Quarter Results and Affirms Full Year Guidance,1715166000.0
BCO,The Brink's Company,"BCO Stock Earnings: Brink’s Beats EPS, Beats Revenue for Q1 2024",1715165880.0
BCO,The Brink's Company,"Ex-Dividend Reminder: Brinks, Comfort Systems USA and United Parcel Service",1715159880.0
BCO,The Brink's Company,Brink : First Quarter 2024 Earnings Presentation,1715153590.0
BCO,The Brink's Company,Brink's: Q1 Earnings Snapshot,1715153423.0
BCO,The Brink's Company,"The Brink's Non-GAAP EPS of $1.52 beats by $0.29, revenue of $1.23B beats by $20M",1715149740.0
BCO,The Brink's Company,Brink's sees FY24 EPS from continuing operations $7.30-$8.00,1715149080.0
BCO,The Brink's Company,Brink's reports Q1 EPS $1.52 vs $1.27 last year,1715149080.0
BCO,The Brink's Company,Brink’s Company Enhances Earnings Insight with Informative Slides,1715148780.0
BEN,"Franklin Resources, Inc.",Benefit Street Partners Closes Second Special Situations Fund,1715175185.0
BEN,"Franklin Resources, Inc.",4 Dividend Aristocrats To Buy In May Plus 4 To Watch,1715169884.0
BEP,Brookfield Renewable Partners L.P.,Brookfield: I'm Staying Long Ahead Of Q1 Earnings,1715171262.0
BEPC,Brookfield Renewable Corporation,Brookfield: I'm Staying Long Ahead Of Q1 Earnings,1715171262.0
BERY,"Berry Global Group, Inc.",Notable earnings before Thursday's open,1715168280.0
BERY,"Berry Global Group, Inc.",Berry Global Group FQ2 2024 Earnings Preview,1715165820.0
BFAM,Bright Horizons Family Solutions Inc.,Bright Horizons Family Solutions (BFAM) Price Target Increased by 6.45% to 114.13,1715131422.0
BFH,"Bread Financial Holdings, Inc.","Bread Financial Holdings, Inc.'s (NYSE:BFH) CEO Might Not Expect Shareholders To Be So Generous This Year",1715163907.0
BFH,"Bread Financial Holdings, Inc.",Bread Financial Holdings (BFH) Price Target Increased by 7.76% to 40.12,1715144438.0
BGS,"B&G Foods, Inc.",Analysts Offer Insights on Consumer Goods Companies: B&G Foods (BGS) and Edgewell Personal Care (EPC),1715145060.0
BHE,"Benchmark Electronics, Inc.",Benchmark Electronics (BHE) Price Target Increased by 10.85% to 36.46,1715187047.0
BHP,BHP Group Limited,Form 8.3 - BHP Group Ltd,1715178300.0
BIG,"Big Lots, Inc.",Looking Into Big Lots's Recent Short Interest,1715156280.0
BILL,"BILL Holdings, Inc.",1 No-Brainer Stock to Buy With $60 and Hold for 10 Years,1715155800.0
BIO,"Bio-Rad Laboratories, Inc.",What's Driving Globus Medical Inc's Surprising 20% Stock Rally?,1715163480.0
BIO,"Bio-Rad Laboratories, Inc.","Analysts Are Bullish on These Healthcare Stocks: Bio-Rad Laboratories (BIO), Caribou Biosciences (CRBU)",1715146860.0
BIP,Brookfield Infrastructure Partners L.P.,Buy SCHD And These 4 High Yields For A Diversified Retirement Dividend Portfolio,1715156100.0
BIPC,Brookfield Infrastructure Corporation,Buy SCHD And These 4 High Yields For A Diversified Retirement Dividend Portfolio,1715156100.0
BK,The Bank of New York Mellon Corporation,BNY Mellon appoints Japan country executive,1715165838.0
BKD,Brookdale Senior Living Inc.,Brookdale Senior Living Inc. (BKD) Q1 2024 Earnings Call Transcript,1715172429.0
BLD,TopBuild Corp.,TopBuild Corp (BLD) Q1 2024 Earnings Call Transcript Highlights: Robust Growth and Strategic ...,1715153126.0
BLD,TopBuild Corp.,Q1 2024 TopBuild Corp Earnings Call,1715139942.0
BLDR,"Builders FirstSource, Inc.",Builders FirstSource First Quarter 2024 Earnings: Beats Expectations,1715170246.0
BLDR,"Builders FirstSource, Inc.",30 Cheap Large Cap Stocks On Sale Now For May 2024,1715147742.0
BLDR,"Builders FirstSource, Inc.",Builders FirstSource: Disappointing Q1 As Multifamily Weighs,1715143700.0
BLK,"BlackRock, Inc.",Ares Capital's Q1 Has Important Ramifications For The BDC Sector,1715173778.0
BLK,"BlackRock, Inc.",Is BlackRock Advantage Small Cap Core A (BDSAX) a Strong Mutual Fund Pick Right Now?,1715166005.0
BLK,"BlackRock, Inc.",Decoding BlackRock Inc (BLK): A Strategic SWOT Insight,1715144562.0
BLK,"BlackRock, Inc.",BSTZ: Deep Discount And Potential Activist Catalyst,1715131295.0
BMA,Banco Macro S.A.,Banco Macro S.A. - Depositary Receipt () (BMA) Price Target Increased by 58.25% to 57.94,1715140843.0
BN,Brookfield Corporation,Ares Capital's Q1 Has Important Ramifications For The BDC Sector,1715173778.0
BN,Brookfield Corporation,Brookfield: I'm Staying Long Ahead Of Q1 Earnings,1715171262.0
BN,Brookfield Corporation,Brookfield Asset Management reports Q1 profit down from year ago,1715156771.0
BN,Brookfield Corporation,Brookfield: Q1 Earnings Snapshot,1715151430.0
BNED,"Barnes & Noble Education, Inc.",Immersion: An Able Capital Allocator Is Leading A Transformation,1715154421.0
BOOT,"Boot Barn Holdings, Inc.",What You Missed On Wall Street This Morning,1715165940.0
BOOT,"Boot Barn Holdings, Inc.","Spruce Point Capital Management Announces Investment Opinion: Releases Report and Strong Sell Research Opinion on Boot Barn Holdings, Inc. (NYSE: BOOT)",1715158800.0
