ticker,company,headline,datetime
GOOGL,Alphabet Inc.,DeepMind Alumni Raise $200 Million Round for Holistic AI,1715155506.0
GOOGL,Alphabet Inc.,Stock buybacks hit highest level since 2018,1715155210.0
GOOGL,Alphabet Inc.,This Magnificent Artificial Intelligence (AI) Stock Is Now in the $2 Trillion Club,1715148000.0
GPRO,"GoPro, Inc.","GoPro, Inc. (NASDAQ:GPRO) Q1 2024 Earnings Call Transcript",1715182821.0
GPRO,"GoPro, Inc.",Q1 2024 GoPro Inc Earnings Call,1715166768.0
GPRO,"GoPro, Inc.",GoPro Inc (GPRO) Q1 2024 Earnings Call Transcript Highlights: Navigating Challenges and ...,1715155933.0
GPRO,"GoPro, Inc.",GoPro (GPRO) Q1 2024 Earnings Call Transcript,1715143516.0
GSBC,"Great Southern Bancorp, Inc.",Great Southern Bancorp : 35th Annual Meeting of Stockholders Presenter Scripts,1715167154.0
GSBC,"Great Southern Bancorp, Inc.",Great Southern Bancorp : 35th Annual Meeting of Stockholders,1715167032.0
GT,The Goodyear Tire & Rubber Company,Goodyear Tire & Rubber First Quarter 2024 Earnings: Misses Expectations,1715163003.0
GT,The Goodyear Tire & Rubber Company,Goodyear Tire & Rubber Co (GT) (Q1 2024) Earnings Call Transcript Highlights: Navigating ...,1715151680.0
GT,The Goodyear Tire & Rubber Company,Q1 2024 Goodyear Tire & Rubber Co Earnings Call,1715136253.0
GTHX,"G1 Therapeutics, Inc.",G1 Therapeutics : May 2024 Corporate Presentation,1715157377.0
HA,"Hawaiian Holdings, Inc.","Hawaiian Holdings, Inc. (NASDAQ:HA) is largely controlled by institutional shareholders who own 67% of the company",1715168319.0
HAIN,"The Hain Celestial Group, Inc.",Hain Celestial (HAIN) Lowers FY24 View Despite Q3 Earnings Beat,1715185320.0
HAIN,"The Hain Celestial Group, Inc.","The Hain Celestial Group, Inc. (HAIN) Q3 2024 Earnings Call Transcript",1715174771.0
HAIN,"The Hain Celestial Group, Inc.",Hain Celestial Q3 Fiscal 2024 Earnings: Adjusted EPS Surpasses Estimates Amidst Challenges,1715172004.0
HAIN,"The Hain Celestial Group, Inc.",Hain Celestial (NASDAQ:HAIN) Misses Q1 Sales Targets,1715166700.0
HAIN,"The Hain Celestial Group, Inc.",Hain Celestial Reports Fiscal Third Quarter 2024 Financial Results,1715166000.0
HAIN,"The Hain Celestial Group, Inc.",Hain Celestial: Fiscal Q3 Earnings Snapshot,1715153074.0
HAIN,"The Hain Celestial Group, Inc.",Hain Celestial : Earnings Q3 2024 Conference Call Presentation,1715152030.0
HALO,"Halozyme Therapeutics, Inc.","Halozyme's (HALO) Q1 Earnings Beat, Revenues Lag Estimates",1715178840.0
HALO,"Halozyme Therapeutics, Inc.",Halozyme to Participate in Upcoming Investor Conferences,1715171400.0
HALO,"Halozyme Therapeutics, Inc.",Q1 2024 Halozyme Therapeutics Inc Earnings Call,1715166343.0
HALO,"Halozyme Therapeutics, Inc.",Halozyme Therapeutics Inc (HALO) (Q1 2024) Earnings Call Transcript Highlights: Robust Growth ...,1715154758.0
HAS,"Hasbro, Inc.",Monopoly Game Maker Hasbro Selling $500 Million Bond,1715191149.0
HBIO,"Harvard Bioscience, Inc.",Harvard Bioscience Inc (HBIO) (Q1 2024) Earnings Call Transcript Highlights: Navigating ...,1715151794.0
HCKT,"The Hackett Group, Inc.",The Hackett Group Inc (HCKT) Q1 2024 Earnings Call Transcript Highlights: Strategic Moves and ...,1715155559.0
HCKT,"The Hackett Group, Inc.","The Hackett Group, Inc. (HCKT) Q1 2024 Earnings Call Transcript",1715127669.0
HCM,HUTCHMED (China) Limited,UK shareholder meetings calendar - next 7 days,1715165700.0
HCM,HUTCHMED (China) Limited,HUTCHMED Announces Appointment of Independent Non-executive Director and Member of Board Committee,1715157000.0
HCM,HUTCHMED (China) Limited,HUTCHMED Welcomes New Board Member Expertise,1715149920.0
HCM,HUTCHMED (China) Limited,HUTCHMED Appoints New Board Director,1715140080.0
HEAR,Turtle Beach Corporation,Turtle Beach participates in a conference call with Maxim Group,1715156400.0
HEAR,Turtle Beach Corporation,Turtle Beach Corp (HEAR) Q1 2024 Earnings Call Transcript Highlights: Strategic Moves and ...,1715155536.0
HEAR,Turtle Beach Corporation,Wall Street Analysts Are Bullish on Top Technology Picks,1715155260.0
HEAR,Turtle Beach Corporation,Wedbush Remains a Buy on Turtle Beach (HEAR),1715153280.0
HEAR,Turtle Beach Corporation,Turtle Beach (HEAR) Q1 2024 Earnings Call Transcript,1715143514.0
HEES,"H&E Equipment Services, Inc.",Hidden Gems: Unveiling the 10 Stocks on Hedge Funds’ Radar,1715185581.0
HIMX,"Himax Technologies, Inc.",Himax (HIMX) Reports Q1: Everything You Need To Know Ahead Of Earnings,1715152004.0
HLIT,Harmonic Inc.,Harmonic Sets the Pace for Intelligent Broadband Networks at ANGA COM 2024,1715151900.0
HLMN,Hillman Solutions Corp.,Hillman Solutions: Ready For Tuck-In Acquisitions,1715171002.0
HLMN,Hillman Solutions Corp.,Hillman Solutions Corp (HLMN) Q1 2024 Earnings Call Transcript Highlights: Robust Growth and ...,1715152708.0
HNRG,Hallador Energy Company,Hallador Energy Company (NASDAQ:HNRG) Q1 2024 Earnings Call Transcript,1715178560.0
HNRG,Hallador Energy Company,Q1 2024 Hallador Energy Co Earnings Call,1715158421.0
HNRG,Hallador Energy Company,Hallador Energy Co (HNRG) (Q1 2024) Earnings Call Transcript Highlights: Navigating Financial ...,1715154499.0
HOLX,"Hologic, Inc.",Is High Tide (HITI) Stock Outpacing Its Medical Peers This Year?,1715175611.0
HON,Honeywell International Inc.,HONEYWELL ANNOUNCES PARTICIPATION AT UPCOMING INVESTOR CONFERENCES,1715173200.0
HOOD,"Robinhood Markets, Inc.",Robinhood Earnings Will Put a Spotlight on Regulatory Issues and Investor Engagement,1715169600.0
HOOD,"Robinhood Markets, Inc.","The Zacks Analyst Blog Highlights NVIDIA, Coinbase, Robinhood Markets, CleanSpark and  Interactive Brokers",1715160180.0
HOOD,"Robinhood Markets, Inc.",Three Growth Companies With High Insider Ownership And At Least 10% Revenue Growth,1715151871.0
HOPE,"Hope Bancorp, Inc.",Hope Bancorp to Participate in D.A. Davidson’s 26th Annual Financial Institutions Conference,1715157125.0
HQY,"HealthEquity, Inc.",Why This 1 Momentum Stock Could Be a Great Addition to Your Portfolio,1715176210.0
HRMY,"Harmony Biosciences Holdings, Inc.","Commit To Purchase Harmony Biosciences Holdings At $17.50, Earn 13.4% Annualized Using Options",1715165160.0
HRTX,"Heron Therapeutics, Inc.",Heron Therapeutics First Quarter 2024 Earnings: Beats Expectations,1715163407.0
HRTX,"Heron Therapeutics, Inc.",Heron Therapeutics Inc (HRTX) Q1 2024 Earnings Call Transcript Highlights: Significant ...,1715152210.0
HSIC,"Henry Schein, Inc.",Why Henry Schein (HSIC) is a Top Value Stock for the Long-Term,1715175611.0
HSIC,"Henry Schein, Inc.",Henry Schein First Quarter 2024 Earnings: Misses Expectations,1715165338.0
HSIC,"Henry Schein, Inc.",Expert Outlook: Henry Schein Through The Eyes Of 7 Analysts,1715159040.0
HSIC,"Henry Schein, Inc.",Analysts Have Conflicting Sentiments on These Healthcare Companies: Henry Schein (HSIC) and Esperion (ESPR),1715156520.0
HSIC,"Henry Schein, Inc.","Henry Schein price target raised by $2 at Barrington, here's why",1715155740.0
HSIC,"Henry Schein, Inc.",Henry Schein Inc (HSIC) Q1 2024 Earnings Call Transcript Highlights: Navigating Challenges and ...,1715153324.0
HSIC,"Henry Schein, Inc.",Q1 2024 Henry Schein Inc Earnings Call,1715145297.0
HSIC,"Henry Schein, Inc.",Henry Schein Sell Rating Affirmed Amidst Cybersecurity Woes and Execution Risks,1715142480.0
HSII,"Heidrick & Struggles International, Inc.",Heidrick & Struggles: Undervaluation Persists Amid Solid Q1 Results,1715156423.0
HSII,"Heidrick & Struggles International, Inc.",Unregistered Equity Sales: The Risks and Impacts on Heidrick & Struggles International’s Reputation and Market Trust,1715130180.0
HTLF,"Heartland Financial USA, Inc.",Director Robert Engel Sells Shares of Heartland Financial USA Inc (HTLF),1715149419.0
IAC,IAC Inc.,12 Best Gig Economy Stocks To Buy,1715188075.0
IAC,IAC Inc.,IAC Inc. (IAC) Q1 2024 Earnings Call Transcript,1715174290.0
IAS,Integral Ad Science Holding Corp.,"SYTA, IAS and AIRE among pre-market losers",1715154000.0
IAS,Integral Ad Science Holding Corp.,"Flywire Reports Q1 Loss, Joins ZoomInfo, Inspire Medical Systems And Other Big Stocks Moving Lower In Wednesday's Pre-Market Session",1715145060.0
IBKR,"Interactive Brokers Group, Inc.","The Zacks Analyst Blog Highlights NVIDIA, Coinbase, Robinhood Markets, CleanSpark and  Interactive Brokers",1715160180.0
ICHR,"Ichor Holdings, Ltd.",Forecasting The Future: 7 Analyst Projections For Ichor Hldgs,1715166360.0
ICHR,"Ichor Holdings, Ltd.","Ichor Holdings price target lowered by $5 at Craig-Hallum, here's why",1715155200.0
ICHR,"Ichor Holdings, Ltd.",Ichor Holdings Ltd (ICHR) Q1 2024 Earnings Call Transcript Highlights: Stability and Strategic ...,1715154841.0
ICHR,"Ichor Holdings, Ltd.","Analysts Offer Insights on Technology Companies: Alpha and Omega (AOSL), Adeia (ADEA) and Ichor Holdings (ICHR)",1715151060.0
ICHR,"Ichor Holdings, Ltd.","Ichor Holdings price target raised by $6 at TD Cowen, here's why",1715150040.0
ICUI,"ICU Medical, Inc.","Analysts Are Bullish on These Healthcare Stocks: ICU Medical (ICUI), AbCellera Biologics (ABCL)",1715134260.0
ICUI,"ICU Medical, Inc.",ICU Medical Inc (ICUI) Q1 2024 Earnings Call Transcript Highlights: Navigating Challenges with ...,1715132700.0
IDYA,"IDEAYA Biosciences, Inc.",IDEAYA Biosciences First Quarter 2024 Earnings: US$0.53 loss per share (vs US$0.49 loss in 1Q 2023),1715168500.0
IEP,Icahn Enterprises L.P.,Why Shares of Icahn Enterprises Are Up Today,1715186879.0
IEP,Icahn Enterprises L.P.,Icahn Enterprises L.P. (IEP) Q1 2024 Earnings Call Transcript,1715175009.0
IEP,Icahn Enterprises L.P.,Icahn Enterprises L.P. (Nasdaq: IEP) Today Announced Its First Quarter 2024 Financial Results,1715169600.0
IEP,Icahn Enterprises L.P.,Icahn Enterprises L.P. 2024 Q1 - Results - Earnings Call Presentation,1715168589.0
IEP,Icahn Enterprises L.P.,Icahn Enterprises L P : IEP Q1 2024 Webcast FINAL,1715161148.0
IEP,Icahn Enterprises L.P.,Icahn Enterprises: Q1 Earnings Snapshot,1715156176.0
IGIC,International General Insurance Holdings Ltd.,International General Insurance Holdings Ltd. (IGIC) Q1 2024 Earnings Call Transcript,1715170689.0
IGIC,International General Insurance Holdings Ltd.,"IGI Establishes a Presence in Lloyd’s, Begins Trading May 9, 2024",1715169600.0
IGIC,International General Insurance Holdings Ltd.,International General Insurance Holdings Ltd. 2024 Q1 - Results - Earnings Call Presentation,1715166437.0
IHRT,"iHeartMedia, Inc.",IHeartMedia : IHeartPodcasts and Kaleidoscope Partner with John Legend to Debut Riveting New Series “Afghan Star”,1715178907.0
IHRT,"iHeartMedia, Inc.",NBCUniversal Chooses iHeartMedia as the Exclusive Audio Partner for Its Coverage of This Summer’s Paris Olympic Games,1715161565.0
IMCR,Immunocore Holdings plc,"Immunocore Holdings PLC Reports Q1 2024 Earnings: Misses EPS Estimates, Surpasses Revenue Forecasts",1715171892.0
IMCR,Immunocore Holdings plc,Immunocore reports first quarter financial results and provides a business update,1715166000.0
IMMR,Immersion Corporation,Immersion: An Able Capital Allocator Is Leading A Transformation,1715154421.0
IMXI,"International Money Express, Inc.","International Money Express, Inc. (IMXI) Q1 2024 Earnings Call Transcript",1715176265.0
IMXI,"International Money Express, Inc.",International Money Express (IMXI) Beats Q1 Earnings Estimates,1715174102.0
IMXI,"International Money Express, Inc.",International Money Express Inc (IMXI) Q1 Earnings: Aligns with EPS Projections and Surpasses ...,1715172930.0
IMXI,"International Money Express, Inc.","International Money Express, Inc. 2024 Q1 - Results - Earnings Call Presentation",1715170267.0
IMXI,"International Money Express, Inc.",Intermex Reports First Quarter Results,1715169600.0
IMXI,"International Money Express, Inc.",International Money Express : Q1 2024 Earnings Deck,1715157969.0
IMXI,"International Money Express, Inc.",International Money Express: Q1 Earnings Snapshot,1715156236.0
INGN,"Inogen, Inc.",Q1 2024 Inogen Inc Earnings Call,1715166883.0
INGN,"Inogen, Inc.",Inogen Inc (INGN) Q1 2024 Earnings Call Transcript Highlights: Navigating Market Dynamics with ...,1715155655.0
INGN,"Inogen, Inc.",Needham Sticks to Their Hold Rating for Inogen (INGN),1715144940.0
INGN,"Inogen, Inc.",Here's What Key Metrics Tell Us About Inogen (INGN) Q1 Earnings,1715126406.0
INMD,InMode Ltd.,InMode: Facing A Myraid Of Headwinds,1715173020.0
INMD,InMode Ltd.,InMode Announces P1 Offshore Racing Partnership with Female Driver Victoria Rand,1715169780.0
INNV,InnovAge Holding Corp.,Q3 2024 InnovAge Holding Corp Earnings Call,1715165481.0
INNV,InnovAge Holding Corp.,InnovAge Holding Corp (INNV) (Q3 2024) Earnings Call Transcript Highlights: Navigating ...,1715156097.0
INSM,Insmed Incorporated,Should You Buy Insmed (INSM) Ahead of Earnings?,1715177940.0
INTA,"Intapp, Inc.",Q3 2024 Intapp Inc Earnings Call,1715173991.0
INTC,Intel Corporation,Trending : Intel Says Certain Licenses for Exports to Chinese Customer Blocked,1715179276.0
INTC,Intel Corporation,Super Micro Computer: Growth May Slow In 2025,1715177997.0
INTC,Intel Corporation,News Highlights : Top Company News of the Day - Wednesday at 11 AM ET,1715167008.0
INTC,Intel Corporation,Deadline Reminder: Law Offices of Howard G. Smith Reminds Investors of Looming Deadline in the Class Action Lawsuit Against Intel Corporation (INTC),1715166126.0
INTC,Intel Corporation,Top Takeaways Intel's Corporate Responsibility Report,1715158954.0
INTC,Intel Corporation,Intel Says US Commerce Department Revokes Licenses for Exports of Certain Items to Chinese Customer,1715157988.0
INTC,Intel Corporation,Intel flags revenue hit as U.S. revokes certain export licenses to Chinese customer,1715155484.0
INTC,Intel Corporation,Intel : Regulation FD Disclosure - Form 8-K,1715154789.0
INTC,Intel Corporation,"Wall Street Breakfast Podcast: U.S. Reportedly Restricts Qualcomm, Intel Over Huawei Supply",1715151247.0
INTC,Intel Corporation,"US Revokes Intel, Qualcomm Licenses to Sell Chips to Huawei",1715129985.0
INVA,"Innoviva, Inc.",Innoviva to Participate in the BofA Securities Health Care Conference,1715166000.0
INVZ,Innoviz Technologies Ltd.,Innoviz Technologies Ltd (INVZ) Q1 2024 Earnings Call Transcript,1715180229.0
INVZ,Innoviz Technologies Ltd.,"Innoviz Reports First-Quarter 2024 Results, Exceeds Revenue Guidance for Second Consecutive Quarter and Expands Key Partner and Customer Relationships",1715166000.0
INVZ,Innoviz Technologies Ltd.,"Shareholders of Innoviz Technologies Ltd. Should Contact Levi & Korsinsky Before May 14, 2024 to Discuss Your Rights - INVZ",1715147181.0
IONS,"Ionis Pharmaceuticals, Inc.","Ionis (IONS) Q1 Loss Narrower Than Expected, Sales Miss",1715179140.0
IONS,"Ionis Pharmaceuticals, Inc.","Ionis Pharmaceuticals First Quarter 2024 Earnings: EPS Beats Expectations, Revenues Lag",1715167958.0
IONS,"Ionis Pharmaceuticals, Inc.",Q1 2024 Ionis Pharmaceuticals Inc Earnings Call,1715160047.0
IONS,"Ionis Pharmaceuticals, Inc.",Ionis Pharmaceuticals Inc (IONS) Q1 2024 Earnings Call Transcript Highlights: Key Developments ...,1715154033.0
IPAR,"Inter Parfums, Inc.","Sally Beauty: A Deep-Value Winner, Nobody Is Talking About",1715162400.0
IPGP,IPG Photonics Corporation,IPG Photonics Launches Cobot Laser Welding and Cleaning System,1715173200.0
IRBT,iRobot Corporation,Why iRobot Stock Zoomed Higher on Wednesday,1715184185.0
IRBT,iRobot Corporation,iRobot (IRBT) Incurs Narrower-Than-Expected Net Loss in Q1,1715182560.0
IRBT,iRobot Corporation,iRobot Corporation (IRBT) Q1 2024 Earnings Call Transcript,1715167262.0
IRWD,"Ironwood Pharmaceuticals, Inc.",Ironwood Pharmaceuticals Q1 2024 Earnings Preview,1715163720.0
ITCI,"Intra-Cellular Therapies, Inc.",Intra-Cellular Therapies to Participate in Two Upcoming Investor Conferences,1715169600.0
ITCI,"Intra-Cellular Therapies, Inc.",Intra-Cellular Therapies Inc (ITCI) Q1 2024 Earnings Call Transcript Highlights: Robust Revenue ...,1715152423.0
ITRI,"Itron, Inc.",Here's How Much You'd Have If You Invested $1000 in Itron a Decade Ago,1715171405.0
JACK,Jack in the Box Inc.,Jack In The Box: Capitulation With Del Taco,1715159384.0
JACK,Jack in the Box Inc.,Datadog To Rally Around 25%? Here Are 10 Top Analyst Forecasts For Wednesday,1715154240.0
JACK,Jack in the Box Inc.,Analysts Offer Insights on Consumer Cyclical Companies: Jack In The Box (JACK) and PUMA SE NPV (OtherPMMAF),1715148780.0
JACK,Jack in the Box Inc.,"Jack in the Box price target lowered by $14 at Piper Sandler, here's why",1715148360.0
JANX,"Janux Therapeutics, Inc.","Janux Therapeutics Reports Narrower Q1 Loss, Misses Revenue Estimates",1715167942.0
JD,"JD.com, Inc.",International Wide-Moat Stocks On Sale - The May 2024 Heat Map,1715169717.0
JJSF,J&J Snack Foods Corp.,J&J Snack Foods : 2024 2ND QUARTER EARNINGS CALL,1715161148.0
JJSF,J&J Snack Foods Corp.,Q2 2024 J & J Snack Foods Corp Earnings Call,1715154999.0
JJSF,J&J Snack Foods Corp.,J&J Snack Foods Corp (JJSF) Q2 2024 Earnings Call Transcript Highlights: Stellar Growth and ...,1715153241.0
KALU,Kaiser Aluminum Corporation,Here Is Why Bargain Hunters Would Love Fast-paced Mover Kaiser (KALU),1715172606.0
KDP,Keurig Dr Pepper Inc.,30 Cheap Large Cap Stocks On Sale Now For May 2024,1715147742.0
KE,"Kimball Electronics, Inc.","Kimball Electronics, Inc. 2024 Q3 - Results - Earnings Call Presentation",1715179347.0
KE,"Kimball Electronics, Inc.","Kimball Electronics, Inc. (KE) Q3 2024 Earnings Call Transcript",1715179262.0
KELYA,"Kelly Services, Inc.",Kelly to Participate in the 18th Annual Barrington Research Virtual Spring Investment Conference,1715167800.0
KHC,The Kraft Heinz Company,30 Cheap Large Cap Stocks On Sale Now For May 2024,1715147742.0
KIDS,OrthoPediatrics Corp.,Q1 2024 OrthoPediatrics Corp Earnings Call,1715136791.0
KLTR,"Kaltura, Inc.","Kaltura, Inc. (KLTR) Reports Q1 Loss, Tops Revenue Estimates",1715171106.0
KLTR,"Kaltura, Inc.",Kaltura Announces Financial Results for First Quarter 2024,1715166000.0
KLTR,"Kaltura, Inc.","KLTR Stock Earnings: Kaltura Misses EPS, Beats Revenue for Q1 2024",1715165880.0
KLTR,"Kaltura, Inc.","Kaltura GAAP EPS of $0.03 beats by $0.10, revenue of $44.8M beats by $1.76M",1715150160.0
KLTR,"Kaltura, Inc.","Kaltura sees Q2 revenue $42.7M-$43.5M, consensus $43.4M",1715148660.0
KLTR,"Kaltura, Inc.","Kaltura sees FY24 revenue $173.7M-$176.7M, consensus $175.06M",1715148660.0
KLTR,"Kaltura, Inc.","Kaltura reports Q1 EPS (3c), consensus (2c)",1715148660.0
KLXE,"KLX Energy Services Holdings, Inc.","KLX Energy Services Holdings, Inc. (KLXE) Q1 2024 Earnings Call Transcript",1715177591.0
KMDA,Kamada Ltd.,Kamada Ltd. (KMDA) Q1 2024 Earnings Call Transcript,1715169304.0
KMDA,Kamada Ltd.,Kamada Reports Strong First Quarter 2024 Financial Results with Year-Over-Year Top-Line Growth of 23% and a 96% Increase in Profitability; Raises Full-Year Financial Guidance,1715166000.0
KMDA,Kamada Ltd.,"KMDA Stock Earnings: Kamada Misses EPS, Misses Revenue for Q1 2024",1715165880.0
KMDA,Kamada Ltd.,Kamada: Q1 Earnings Snapshot,1715153592.0
KMDA,Kamada Ltd.,"Kamada : Financial Highlights for the Three Months Ended March 31, 2024",1715152397.0
KMDA,Kamada Ltd.,Kamada Ltd. Reports Strong Growth and Raises Guidance,1715151480.0
KMDA,Kamada Ltd.,"Kamada GAAP EPS of $0.04 misses by $0.02, revenue of $37.7M misses by $0.24M",1715148360.0
KMDA,Kamada Ltd.,Kamada raises FY24 revenue to $158M-$162M from $156M-$160M,1715148300.0
KMDA,Kamada Ltd.,Kamada reports Q1 EPS 4c vs (4c) last year,1715148240.0
KPTI,Karyopharm Therapeutics Inc.,Karyopharm Therapeutics Inc. (KPTI) Q1 2024 Earnings Call Transcript,1715182732.0
KPTI,Karyopharm Therapeutics Inc.,Karyopharm Reports First Quarter 2024 Financial Results and Highlights Recent Company Progress,1715167800.0
KPTI,Karyopharm Therapeutics Inc.,Karyopharm Announces Significant Refinancing Transactions and Amended Royalty Agreement Extending Vast Majority of Its Debt Maturities into 2028 and 2029,1715167800.0
KPTI,Karyopharm Therapeutics Inc.,Karyopharm Therapeutics: Q1 Earnings Snapshot,1715154191.0
KRNT,Kornit Digital Ltd.,Kornit Digital Ltd. (KRNT) Q1 2024 Earnings Call Transcript,1715181436.0
KRNT,Kornit Digital Ltd.,"KRNT Stock Earnings: Kornit Digital Beats EPS, Misses Revenue for Q1 2024",1715169540.0
KRNT,Kornit Digital Ltd.,Kornit Digital Reports First Quarter 2024 Results,1715167800.0
KRNT,Kornit Digital Ltd.,Kornit Digital: Q1 Earnings Snapshot,1715154072.0
KRNT,Kornit Digital Ltd.,"Kornit Digital  sees Q2 revenue $47M-$52M, consensus $53.45M",1715150700.0
KRNT,Kornit Digital Ltd.,"Kornit Digital Non-GAAP EPS of -$0.11 beats by $0.03, revenue of $43.8M misses by $1.28M",1715150520.0
KRNT,Kornit Digital Ltd.,"Kornit Digital reports Q1 EPS (11c), consensus (13c)",1715149920.0
KROS,"Keros Therapeutics, Inc.",Keros Therapeutics Reports Recent Business Highlights and First Quarter 2024 Financial Results,1715169600.0
KRYS,"Krystal Biotech, Inc.",Krystal Biotech to Present at BofA Securities 2024 Health Care Conference,1715166000.0
KRYS,"Krystal Biotech, Inc.",Biotech Alert: Searches spiking for these stocks today,1715163060.0
KRYS,"Krystal Biotech, Inc.",Krystal Biotech Reveals Eye Treatment Vector at ARVO 2024,1715145300.0
KTOS,"Kratos Defense & Security Solutions, Inc.",Is Kratos Stock A Good Buy After Earnings?,1715182918.0
KTOS,"Kratos Defense & Security Solutions, Inc.",Kratos Defense & Security Solutions Inc (KTOS) (Q1 2024) Earnings Call Transcript ...,1715158874.0
KTOS,"Kratos Defense & Security Solutions, Inc.",Noble Financial Remains a Buy on Kratos Defense (KTOS),1715153280.0
KTOS,"Kratos Defense & Security Solutions, Inc.","Analysts’ Opinions Are Mixed on These Industrial Goods Stocks: TopBuild (BLD), Expeditors International (EXPD) and Kratos Defense (KTOS)",1715148600.0
KTOS,"Kratos Defense & Security Solutions, Inc.","Analysts Offer Insights on Industrial Goods Companies: Kratos Defense (KTOS), GE Aerospace (GE) and Builders Firstsource (BLDR)",1715147400.0
KURA,"Kura Oncology, Inc.",Kura Oncology to Participate in Bank of America Securities Healthcare Conference,1715153420.0
KYMR,"Kymera Therapeutics, Inc.",Kymera Therapeutics to Participate in Upcoming May Investor Conferences,1715166000.0
LAKE,"Lakeland Industries, Inc.","Is The Market Rewarding Lakeland Industries, Inc. (NASDAQ:LAKE) With A Negative Sentiment As A Result Of Its Mixed Fundamentals?",1715170779.0
LAKE,"Lakeland Industries, Inc.","Lakeland's Revenues Could Grow By 50% Post-Acquisitions, But It Is Still Overvalued",1715164354.0
LAMR,Lamar Advertising Company,Lamar Advertising : 2024 Proxy,1715159289.0
LANC,Lancaster Colony Corporation,"The Zacks Analyst Blog Highlights Pilgrim's,  Enterprise Products, Lancaster Colony, Amazon and Agnico Eagle",1715163060.0
LAND,Gladstone Land Corporation,Gladstone Land Corporation (LAND) Q1 2024 Earnings Call Transcript,1715171228.0
LAND,Gladstone Land Corporation,Landsec sells entire hotel portfolio for around GBP400 million,1715158560.0
LAND,Gladstone Land Corporation,Landsec Refocuses Portfolio with Strategic Asset Sales,1715151120.0
LBRDA,Liberty Broadband Corporation,Liberty Broadband Corporation (LBRDK) Q1 2024 Earnings Call Transcript,1715175847.0
LBRDA,Liberty Broadband Corporation,Liberty Broadband Reports First Quarter 2024 Financial Results,1715170500.0
LBRDK,Liberty Broadband Corporation,Liberty Broadband Corporation (LBRDK) Q1 2024 Earnings Call Transcript,1715175847.0
LBRDK,Liberty Broadband Corporation,Liberty Broadband (LBRDK) Lags Q1 Earnings Estimates,1715174703.0
LBRDK,Liberty Broadband Corporation,Liberty Broadband Reports First Quarter 2024 Financial Results,1715170500.0
LFMD,"LifeMD, Inc.","Purcell & Lefkowitz LLP Announces Shareholder Investigation of LifeMD, Inc. (NASDAQ: LFMD)",1715157968.0
LGIH,"LGI Homes, Inc.",LGI Homes Announces its Second Community in the Modesto Market,1715155320.0
LGIH,"LGI Homes, Inc.",LGI Homes announces second community in Modesto market,1715152560.0
LGND,Ligand Pharmaceuticals Incorporated,Ligand Pharmaceuticals Incorporated (NASDAQ:LGND) Q1 2024 Earnings Call Transcript,1715188944.0
LGND,Ligand Pharmaceuticals Incorporated,Intra-Cellular (ITCI) Q1 Earnings and Sales Beat Estimates,1715182980.0
LGND,Ligand Pharmaceuticals Incorporated,"Pacira (PCRX) Q1 Earnings Miss, Exparel Sales Drive Revenues",1715182500.0
LGND,Ligand Pharmaceuticals Incorporated,Ligand Pharmaceuticals Inc (LGND) Q1 2024 Earnings Call Transcript Highlights: Strategic Growth ...,1715154665.0
LGND,Ligand Pharmaceuticals Incorporated,Agenus Inc (AGEN) Q1 2024 Earnings Call Transcript Highlights: Strategic Developments and ...,1715152182.0
LGND,Ligand Pharmaceuticals Incorporated,"Analysts Are Bullish on Top Healthcare Stocks: Scholar Rock Holding (SRRK), Zimmer Biomet Holdings (ZBH)",1715146260.0
LGND,Ligand Pharmaceuticals Incorporated,Q1 2024 Agenus Inc Earnings Call,1715136583.0
LI,Li Auto Inc.,Li Auto: My Pick For The EV Market Will Likely Survive A Price War,1715131732.0
LILA,Liberty Latin America Ltd.,Liberty Latin America reports Q1 results,1715165400.0
LIN,Linde plc,Clean Energy Superstars: 3 Stocks Aiming for 300% Gains by 2028,1715148180.0
LITE,Lumentum Holdings Inc.,Lumentum Holdings Inc. (NASDAQ:LITE) Just Reported And Analysts Have Been Cutting Their Estimates,1715164993.0
LMNR,Limoneira Company,Limoneira's Joint Venture with Lewis Group of Companies Announces Approval for Additional 550 Dwelling Units in Harvest at Limoneira Development Project,1715158956.0
LOPE,"Grand Canyon Education, Inc.","Grand Canyon Education, Inc. (NASDAQ:LOPE) Q1 2024 Earnings Call Transcript",1715185074.0
LOPE,"Grand Canyon Education, Inc.","Grand Canyon Education Q1 Adjusted Profit, Revenue Rise; Updates Guidance",1715157363.0
LOPE,"Grand Canyon Education, Inc.",Grand Canyon Education Inc (LOPE) (Q1 2024) Earnings Call Transcript Highlights: Strong ...,1715154655.0
LPLA,LPL Financial Holdings Inc.,LPL Financial Closes Acquisition of Crown Capital Securities,1715172900.0
LPRO,Open Lending Corporation,Q1 2024 Open Lending Corp Earnings Call,1715168592.0
