ticker,company,headline,datetime
UBS,UBS Group AG,UBS Notes Australia's Central Bank Is Non-Committal But Rates Higher for Longer,1715165998.0
UBS,UBS Group AG,Analysts Offer Insights on Financial Companies: UBS Group AG (UBS) and China Life Insurance Co (OtherCILJF),1715156460.0
UBS,UBS Group AG,"UBS Names New Heads of Real Estate, Debt in Australia",1715142562.0
UBS,UBS Group AG,UBS: Benefits Of Credit Suisse Deal Starting To Show,1715129471.0
UE,Urban Edge Properties,Urban Edge Properties (UE) (Q1 2024) Earnings Call Transcript Highlights: Strategic ...,1715152488.0
UE,Urban Edge Properties,Q1 2024 Urban Edge Properties Earnings Call,1715136102.0
UGP,Ultrapar Participações S.A.,Are Investors Undervaluing Ultrapar Participacoes (UGP) Right Now?,1715175613.0
UGP,Ultrapar Participações S.A.,Best Growth Stocks to Buy for May 8th,1715173800.0
UHS,"Universal Health Services, Inc.",Are You a Value Investor? This 1 Stock Could Be the Perfect Pick,1715175611.0
UIS,Unisys Corporation,Unisys Corporation (UIS) Q1 2024 Earnings Call Transcript,1715174170.0
UIS,Unisys Corporation,Unisys Corporation - Unisys Announces 1Q24 Results,1715133678.0
UIS,Unisys Corporation,Unisys Q1 Results Show Market Confidence,1715133660.0
UL,Unilever PLC,International Wide-Moat Stocks On Sale - The May 2024 Heat Map,1715169717.0
UL,Unilever PLC,UK dividends calendar,1715165340.0
UL,Unilever PLC,"Unilever price target raised by $2 at Argus, here's why",1715159160.0
UNF,UniFirst Corporation,UniFirst to Support Charity Auction Benefiting National Guard Relief Foundation Coinciding with NASCAR Throwback Weekend at Darlington Raceway,1715162484.0
UNM,Unum Group,Unum Group launches Unum Pet Insurance,1715179500.0
USB,U.S. Bancorp,Jeff Auxier's Auxier Asset Management Spring 2024 Market Commentary: A Review,1715167740.0
USB,U.S. Bancorp,"US Bancorp : FR Y-9C Reports at March 31, 2024",1715162230.0
USB,U.S. Bancorp,"US Bancorp : FR Y-9LP Reports at March 31, 2024",1715161990.0
USFD,US Foods Holding Corp.,US Foods Q1 2024 Earnings Preview,1715169600.0
USNA,"USANA Health Sciences, Inc.",Analyst Favorites With Strong Buyback Activity: USANA Health Sciences Ranks As a Top Pick,1715172840.0
USNA,"USANA Health Sciences, Inc.",Insider Sale: CFO G Iiekking Sells Shares of Usana Health Sciences Inc (USNA),1715172240.0
UTL,Unitil Corporation,"Unitil First Quarter 2024 Earnings: EPS Beats Expectations, Revenues Lag",1715163872.0
UTL,Unitil Corporation,Unitil Corp (UTL) Q1 2024 Earnings Call Transcript Highlights: Strong Financial Performance ...,1715153184.0
UTL,Unitil Corporation,Q1 2024 Unitil Corp Earnings Call,1715141443.0
UTZ,"Utz Brands, Inc.",Utz Brands (UTZ) Price Target Increased by 8.72% to 22.53,1715167950.0
UTZ,"Utz Brands, Inc.","Insider Selling at Utz Brands Inc: Director Dylan Lissette Sells 10,003 Shares",1715149549.0
UWMC,UWM Holdings Corporation,UWM Holdings Q1 2024 Earnings Preview,1715167200.0
V,Visa Inc.,"Insiders At Visa Sold US$4.5m In Stock, Alluding To Potential Weakness",1715176810.0
V,Visa Inc.,Visa : Material Agreement - Form 8-K,1715158088.0
V,Visa Inc.,Visa Claims that 90% of Stablecoin Transaction Volumes Are Not Initiated by Humans,1715147141.0
VAC,Marriott Vacations Worldwide Corporation,Q1 2024 Marriott Vacations Worldwide Corp Earnings Call,1715135654.0
VEEV,Veeva Systems Inc.,Veeva Systems Inc. (VEEV) Is a Trending Stock: Facts to Know Before Betting on It,1715173212.0
VFC,V.F. Corporation,4 Dividend Aristocrats To Buy In May Plus 4 To Watch,1715169884.0
VICI,VICI Properties Inc.,Lessons Learned: Trust But Verify,1715151600.0
VIPS,Vipshop Holdings Limited,"Zacks Industry Outlook Highlights GoDaddy, Vipshop  MakeMyTrip and Asure Software",1715159520.0
VIV,Telefônica Brasil S.A.,REFILE-EMERGING MARKETS-Latam FX slides as weaker commodity prices weigh ahead of Brazil rate verdict,1715179394.0
VIV,Telefônica Brasil S.A.,Telefônica Brasil S.A. 2024 Q1 - Results - Earnings Call Presentation,1715176666.0
VIV,Telefônica Brasil S.A.,Telefônica Brasil announces its results for 1Q24,1715127900.0
VLN,Valens Semiconductor Ltd.,Valens Semiconductor Ltd. (VLN) Q1 2024 Earnings Call Transcript,1715170862.0
VLN,Valens Semiconductor Ltd.,Valens Semiconductor Ltd. 2024 Q1 - Results - Earnings Call Presentation,1715163396.0
VLN,Valens Semiconductor Ltd.,Valens Semiconductor Reports First Quarter 2024 Results,1715162400.0
VLN,Valens Semiconductor Ltd.,Valens Semiconductor : Investor Presentation,1715149189.0
VMI,"Valmont Industries, Inc.",Valmont Industries (VMI) Price Target Increased by 8.26% to 294.10,1715177179.0
VMI,"Valmont Industries, Inc.",Valmont Industries First Quarter 2024 Earnings: EPS Beats Expectations,1715166205.0
VNO,Vornado Realty Trust,Vornado Realty Trust (VNO) Q1 2024 Earnings Call Transcript Highlights: Key Financial Moves and ...,1715153406.0
VNO,Vornado Realty Trust,Alexander's Inc (ALX) Q1 2024 Earnings Call Transcript Highlights: Strategic Moves Amid ...,1715153337.0
VNO,Vornado Realty Trust,Q1 2024 Vornado Realty Trust and Alexander's Inc Earnings Call,1715146819.0
VRE,"Veris Residential, Inc.",Veris Residential CEO Mahbod Nia Delivers Lecture at MIT Center for Real Estate,1715173200.0
VRT,Vertiv Holdings Co,Vertiv : First Quarter 2024 Supplemental Earnings Slides,1715158567.0
VSCO,Victoria's Secret & Co.,Barclays Downgrades Victoria's Secret (VSCO),1715183100.0
VSH,"Vishay Intertechnology, Inc.","Vishay Intertechnology Space-Grade Planar Transformers Offer Lower Cost, Smaller Size, and Higher Density Than Traditional Planar Devices",1715180400.0
VSH,"Vishay Intertechnology, Inc.",Vishay Intertechnology Inc (VSH) Q1 2024 Earnings: Aligns with EPS Projections Amidst Revenue ...,1715172768.0
VSH,"Vishay Intertechnology, Inc.","Vishay Intertechnology, Inc. (VSH) Q1 2024 Earnings Call Transcript",1715172254.0
VSH,"Vishay Intertechnology, Inc.",Vishay Intertechnology's (NYSE:VSH) Q1 Sales Top Estimates But Quarterly Guidance Underwhelms,1715167706.0
VSH,"Vishay Intertechnology, Inc.",Vishay Intertechnology Reports First Quarter 2024 Results,1715166900.0
VST,Vistra Corp.,New S&P 500 AI Play Jumps On First-Quarter Earnings As It Joins Index,1715176010.0
VST,Vistra Corp.,Vistra Corp (VST) Reports Q1 2024 Earnings: A Detailed Financial Review,1715171564.0
VST,Vistra Corp.,"Vistra Reports First Quarter 2024 Results, Raises Expectations for Energy Harbor and Consolidated Adjusted EBITDA",1715166000.0
VST,Vistra Corp.,Vistra : 2024 First Quarter Presentation,1715152399.0
VST,Vistra Corp.,The Challenge Of Powering AI,1715146309.0
VSTS,Vestis Corporation,Vestis (VSTS) Price Target Decreased by 37.61% to 14.72,1715197064.0
VTS,"Vitesse Energy, Inc.","Vitesse Energy, Inc. (VTS) Receives a Buy from Northland Securities",1715155560.0
VTS,"Vitesse Energy, Inc.","Vitesse Energy price target raised by $3 at Alliance Global Partners, here's why",1715148300.0
VVV,Valvoline Inc.,Here's What Key Metrics Tell Us About Valvoline (VVV) Q2 Earnings,1715175028.0
VVV,Valvoline Inc.,Valvoline Inc. (VVV) Q2 2024 Earnings Call Transcript,1715173567.0
VVV,Valvoline Inc.,Valvoline Inc. (VVV) Q2 Earnings: Strong Growth Amidst Market Challenges,1715171772.0
VVV,Valvoline Inc.,Valvoline (VVV) Surpasses Q2 Earnings and Revenue Estimates,1715170207.0
VVV,Valvoline Inc.,Valvoline Inc. 2024 Q2 - Results - Earnings Call Presentation,1715168727.0
VVV,Valvoline Inc.,Valvoline Inc. Reports Second Quarter Results,1715166000.0
VVV,Valvoline Inc.,"VVV Stock Earnings: Valvoline Beats EPS, Misses Revenue for Q2 2024",1715165880.0
VVV,Valvoline Inc.,Analysts Offer Insights on Energy Companies: Sunoco (SUN) and Valvoline (VVV),1715161860.0
VVV,Valvoline Inc.,Valvoline : Second Quarter 2024 Presentation,1715158695.0
VVV,Valvoline Inc.,Valvoline: Fiscal Q2 Earnings Snapshot,1715152404.0
VVV,Valvoline Inc.,"Valvoline Non-GAAP EPS of $0.37 beats by $0.02, revenue of $389M misses by $1.25M",1715149440.0
VVV,Valvoline Inc.,Valvoline Announces Upcoming Press Release and Webcast,1715148900.0
VVV,Valvoline Inc.,Valvoline narrows FY24 adjusted EPS view to $1.45-$1.65 from $1.40-$1.65,1715148480.0
VVV,Valvoline Inc.,"Valvoline reports Q2 adjusted EPS 37c, consensus 35c",1715148360.0
VVX,"V2X, Inc.",V2X Inc (VVX) Q1 2024 Earnings Call Transcript Highlights: Robust Revenue Growth and Strategic ...,1715151877.0
VVX,"V2X, Inc.",Q1 2024 V2X Inc Earnings Call,1715136941.0
W,Wayfair Inc.,Beyond price target lowered to $19 from $26 at BofA,1715154000.0
WAT,Waters Corporation,"Waters ACQUITY QDa II Mass Detector Delivers Wider Range of Chemical Analysis within Cost-Effective, Lower Energy Instrument",1715155279.0
WAT,Waters Corporation,Decoding Waters Corp (WAT): A Strategic SWOT Insight,1715144579.0
WAT,Waters Corporation,Q1 2024 Waters Corp Earnings Call,1715135446.0
WBS,Webster Financial Corporation,Piper Sandler financial analysts hold a webinar,1715140500.0
WCN,"Waste Connections, Inc.",Waste Connections: Strong Growth Visibility With Structurally Higher Margin Profile,1715131981.0
WEC,"WEC Energy Group, Inc.","We Wouldn't Be Too Quick To Buy WEC Energy Group, Inc. (NYSE:WEC) Before It Goes Ex-Dividend",1715163689.0
WELL,Welltower Inc.,WELL Health Reports Record Quarterly Revenue and Record Net Income for a first quarter in Q1-2024 and Increases Both Revenue and Adjusted EBITDA Guidance for 2024,1715151600.0
WELL,Welltower Inc.,WELL Health Triumphs with Record Q1 Revenue,1715150940.0
WELL,Welltower Inc.,"Welltower price target raised by $7 at Mizuho, here's why",1715148240.0
WFC,Wells Fargo & Company,Investors Heavily Search Wells Fargo & Company (WFC): Here is What You Need to Know,1715173217.0
WFC,Wells Fargo & Company,Fernando Rivas to Join Wells Fargo as Co-CEO of Corporate & Investment Banking,1715172300.0
WFC,Wells Fargo & Company,Wells Fargo Hires Ex-JPMorgan Investment-Bank Boss Fernando Rivas,1715169600.0
WFC,Wells Fargo & Company,Wells Fargo & Co's Dividend Analysis,1715166084.0
WFC,Wells Fargo & Company,Wells Fargo names Fernando Rivas as co-CEO of corporate and investment banking,1715158163.0
WIT,Wipro Limited,Wipro and Kognitos Collaborate to Deploy GenAI-Based Business Automation Solutions,1715167800.0
WIT,Wipro Limited,"DBS Bank gets more bearish on Wipro, downgrades shares",1715166900.0
WIT,Wipro Limited,NHS Scotland implements Rhapsody EMPI for patient data management,1715156499.0
WIT,Wipro Limited,"Wipro, Kognitos announce GenAI partnership",1715150280.0
WM,"Waste Management, Inc.","Broadridge (BR) Q3 Earnings Meet Estimates, Revenues Miss",1715181300.0
WM,"Waste Management, Inc.","Increases to CEO Compensation Might Be Put On Hold For Now at Waste Management, Inc. (NYSE:WM)",1715163468.0
WMB,"The Williams Companies, Inc.",Analysts Have Conflicting Sentiments on These Energy Companies: NuVista Energy (OtherNUVSF) and Williams Co (WMB),1715164320.0
WMB,"The Williams Companies, Inc.","Williams price target raised by $1 at CIBC, here's why",1715163660.0
WMB,"The Williams Companies, Inc.",Williams Companies Inc (WMB) Q1 2024 Earnings Call Transcript Highlights: Robust Growth and ...,1715153391.0
WMB,"The Williams Companies, Inc.",Q1 2024 Williams Companies Inc Earnings Call,1715146392.0
WMB,"The Williams Companies, Inc.",Pipeline Earnings Keep Climbing,1715145540.0
WMB,"The Williams Companies, Inc.",Analysts Offer Insights on Energy Companies: Williams Co (WMB) and BP (BP),1715142840.0
WMK,"Weis Markets, Inc.",Blenheim Group begins site development for Bayberry Town Center,1715162556.0
WMT,Walmart Inc.,Walmart Inc's Dividend Analysis,1715166114.0
WMT,Walmart Inc.,Is It Time to Stop Valuing Apple as a Growth Stock?,1715162400.0
WMT,Walmart Inc.,Legacy media makes new bets on CTV and retail media convergence,1715155200.0
WOLF,"Wolfspeed, Inc.",Wolfspeed (WOLF) Price Target Decreased by 12.23% to 31.71,1715185573.0
WOW,"WideOpenWest, Inc.",WideOpenWest Inc (WOW) (Q1 2024) Earnings Call Transcript Highlights: Navigating Challenges and ...,1715151962.0
WOW,"WideOpenWest, Inc.",Q1 2024 WideOpenWest Inc Earnings Call,1715132112.0
WPC,W. P. Carey Inc.,Buy SCHD And These 4 High Yields For A Diversified Retirement Dividend Portfolio,1715156100.0
WPM,Wheaton Precious Metals Corp.,UK shareholder meetings calendar - next 7 days,1715165700.0
WPM,Wheaton Precious Metals Corp.,"UK earnings, trading statements calendar - next 7 days",1715165520.0
WRB,W. R. Berkley Corporation,Bruce Berkowitz's Strategic Reduction in The St. Joe Co Holdings,1715171220.0
WRK,WestRock Company,WestRock (WRK) Price Target Increased by 6.09% to 53.35,1715159770.0
WSM,"Williams-Sonoma, Inc.",Is Wingstop (WING) Stock Outpacing Its Retail-Wholesale Peers This Year?,1715175610.0
WSM,"Williams-Sonoma, Inc.",Why Investors Need to Take Advantage of These 2 Retail-Wholesale Stocks Now,1715173205.0
WSM,"Williams-Sonoma, Inc.",30 Cheap Large Cap Stocks On Sale Now For May 2024,1715147742.0
WSR,Whitestone REIT,EREZ ASSET MANAGEMENT SENDS LETTER TO WHITESTONE SHAREHOLDERS QUESTIONING RECENT CONDUCT OF WHITESTONE REIT BOARD,1715166000.0
WTM,"White Mountains Insurance Group, Ltd.",MediaAlpha Prices Secondary Offering,1715128680.0
WU,The Western Union Company,OXXO and Western Union Strengthen Cross-Border Remittance Services in Mexico,1715171400.0
WU,The Western Union Company,Western Union and Adonis Announce Strategic Alliance to Enhance Cross-Border Money Transfer Services in Canada,1715169600.0
WU,The Western Union Company,"Western Union to Present at the J.P. Morgan Global Technology, Media and Communications Conference on May 21",1715169600.0
WWW,"Wolverine World Wide, Inc.","Wolverine World Wide, Inc. (WWW) Q1 2024 Earnings Call Transcript",1715179807.0
WWW,"Wolverine World Wide, Inc.","Wolverine World Wide, Inc. 2024 Q1 - Results - Earnings Call Presentation",1715169947.0
WWW,"Wolverine World Wide, Inc.",Wolverine World Wide : Q1 2024 Investor Relations Presentation,1715155514.0
WWW,"Wolverine World Wide, Inc.",Wolverine: Q1 Earnings Snapshot,1715150475.0
WWW,"Wolverine World Wide, Inc.",Wolverine Worldwide Appoints Taryn Miller as Chief Financial Officer,1715149925.0
WWW,"Wolverine World Wide, Inc.",Wolverine Worldwide Exceeds First Quarter Revenue and Earnings Expectations and Posts Record Gross Margin,1715149806.0
WWW,"Wolverine World Wide, Inc.",Wolverine World Wide (WWW) Price Target Increased by 14.29% to 10.78,1715148601.0
WY,Weyerhaeuser Company,Weyerhaeuser : TCFD (Taskforce on Climate-Related Financial Disclosures),1715182148.0
WY,Weyerhaeuser Company,Weyerhaeuser : SDGs (United Nations Sustainable Development Goals),1715182148.0
WY,Weyerhaeuser Company,Weyerhaeuser : SASB (Sustainability Accounting Standards Board),1715182147.0
XOM,Exxon Mobil Corporation,SYLD: A Value ETF Showing Earnings Growth,1715182454.0
XOM,Exxon Mobil Corporation,4 Dividend Aristocrats To Buy In May Plus 4 To Watch,1715169884.0
XOM,Exxon Mobil Corporation,GLNG: ExxonMobil optimistic of FID for Mozambique’s Rovuma LNG by end of 2025,1715163670.0
XOM,Exxon Mobil Corporation,ExxonMobil: Maria J. Dreyfus joins the Board of Directors,1715149183.0
XPER,Xperi Inc.,"Rubric Capital Management Sends Letter to Xperi Inc. Stockholders Highlighting Superior Qualifications and Skills of its Director Nominees, Thomas A. Lacey and Deborah S. Conrad",1715155985.0
XPER,Xperi Inc.,Xperi shareholder Rubric urges stockholders to vote for their board nominees,1715155620.0
XPOF,"Xponential Fitness, Inc.",Xponential Fitness (XPOF) Price Target Decreased by 6.19% to 23.89,1715132353.0
YELP,Yelp Inc.,Tripadvisor Plummet On M&A Rejection Brings The Stock Back Into Play,1715177453.0
YETI,"YETI Holdings, Inc.",Yeti Q1 2024 Earnings Preview,1715166180.0
YOU,"Clear Secure, Inc.",Clear Secure (YOU) Q1 Earnings and Revenues Top Estimates,1715173502.0
YOU,"Clear Secure, Inc.",Clear Secure Inc (YOU) Q1 2024 Earnings Report: Surpasses Analyst Revenue Forecasts,1715168065.0
YOU,"Clear Secure, Inc.","CLEAR Secure, Inc. (YOU) Q1 2024 Earnings Call Transcript",1715162408.0
YOU,"Clear Secure, Inc.",CLEAR Announces First Quarter 2024 Earnings,1715162400.0
YOU,"Clear Secure, Inc.","YOU Stock Earnings: Clear Secure Beats EPS, Beats Revenue for Q1 2024",1715162220.0
YOU,"Clear Secure, Inc.",Clear Secure (YOU) Gets a Buy from Telsey Advisory,1715156940.0
YOU,"Clear Secure, Inc.",Clear Secure: Q1 Earnings Snapshot,1715155453.0
YOU,"Clear Secure, Inc.",Clear Secure : First Quarter 2024 Earnings Webcast,1715149817.0
YOU,"Clear Secure, Inc.",Clear Secure : Shareholder Letter Q1 2024,1715148212.0
YOU,"Clear Secure, Inc.","Clear Secure sees Q2 revenue $182.5M-$184.5M, consensus $182.18M",1715145180.0
YOU,"Clear Secure, Inc.","Clear Secure reports Q1 adjusted EPS 28c, consensus 20c",1715145120.0
YOU,"Clear Secure, Inc.","Clear Secure GAAP EPS of $0.20 beats by $0.10, revenue of $179.05M beats by $5.88M",1715144820.0
YOU,"Clear Secure, Inc.","Analysts Offer Insights on Consumer Cyclical Companies: Zalando (GB:0QXN), ABOUT YOU Holding SE (DE:YOU) and Planet Fitness (PLNT)",1715141040.0
YUM,"Yum! Brands, Inc.","Mattel names Karen Ancira EVP, chief people officer",1715167020.0
YUM,"Yum! Brands, Inc.",Dutch Bros shakes up the sluggish restaurant sector with earnings smasher,1715161980.0
YUM,"Yum! Brands, Inc.",Taco Bell's Arab Heritage Month Spotlight - Mohammad S.,1715157900.0
YUM,"Yum! Brands, Inc.",Decoding Yum Brands Inc (YUM): A Strategic SWOT Insight,1715144632.0
YUMC,"Yum China Holdings, Inc.",International Wide-Moat Stocks On Sale - The May 2024 Heat Map,1715169717.0
ZETA,Zeta Global Holdings Corp.,Zeta Global Holdings (ZETA) Price Target Increased by 14.98% to 18.00,1715183070.0
ZETA,Zeta Global Holdings Corp.,Zeta Global Holdings First Quarter 2024 Earnings: Beats Expectations,1715168965.0
ZH,Zhihu Inc.,Zhihu Inc. Sets AGM Eligibility Date for Shareholders,1715149740.0
ZIP,"ZipRecruiter, Inc.","Affirm Holdings (AFRM) Reports Q3 Loss, Tops Revenue Estimates",1715171703.0
ZVIA,Zevia PBC,Zevia: Q1 Earnings Snapshot,1715152756.0
ZVIA,Zevia PBC,Zevia Announces First Quarter 2024 Results,1715151786.0
AADI,"Aadi Bioscience, Inc.","Aadi Bioscience, Inc. (AADI) Q1 2024 Earnings Call Transcript",1715173083.0
AADI,"Aadi Bioscience, Inc.",Aadi Bioscience Announces Financial Results for the First Quarter 2024 and Provides Corporate Update,1715169600.0
AADI,"Aadi Bioscience, Inc.",Aadi Bioscience : Corporate Presentation,1715155630.0
AAPL,Apple Inc.,Apple’s iPad event was an AI teaser for its future,1715193658.0
AAPL,Apple Inc.,1 Wall Street Analyst Thinks Apple Stock Is Going to $210. Is It a Buy Around $182?,1715190300.0
AAPL,Apple Inc.,It's time to be 'selective' with Big Tech: Nuveen CIO,1715187794.0
AAPL,Apple Inc.,"Apple Loses Another Top Designer, Extending Post-Jony Ive Exodus",1715185818.0
AAPL,Apple Inc.,Apple ETFs in Focus Post New iPad Launch,1715182200.0
AAPL,Apple Inc.,"Apple's New M4 iPads: 'More Powerful Than Any AI PC' Today, Set To Boost Sales",1715181696.0
AAPL,Apple Inc.,SPY: Growing Signs The Market Is Overbought,1715178406.0
AAPL,Apple Inc.,Apple is a formidable opponent. That hasn’t stopped this CEO from suing the tech giant,1715176800.0
AAPL,Apple Inc.,Apple Has A Cash Problem,1715175600.0
AAPL,Apple Inc.,Arm’s Pricey Valuation Ratchets Up Need to Deliver on Earnings,1715173746.0
AAPL,Apple Inc.,Heard on the Street: Rivian Hits Another Bump,1715169608.0
AAPL,Apple Inc.,Apple's iPhone shipments in China rebound with 12% surge in March after price cuts,1715165317.0
AAPL,Apple Inc.,Here Are 3 Big Reasons Berkshire Hathaway Is Sitting on Almost $190 Billion in Cash,1715162580.0
AAPL,Apple Inc.,Massive News for Apple Stock Investors,1715162400.0
AAPL,Apple Inc.,Is It Time to Stop Valuing Apple as a Growth Stock?,1715162400.0
AAPL,Apple Inc.,"Apple: According To My Estimates, 72.3M iPhones Will Need To Be Replaced This Year",1715159376.0
AAPL,Apple Inc.,"Meet the 2 Stocks Warren Buffett Confessed to Selling, as Well as the Other Core Holding He Likely Sent to the Chopping Block",1715159160.0
AAPL,Apple Inc.,"Trending tickers: Apple, Reddit, JD Wetherspoon, Toyota and ARM",1715158003.0
AAPL,Apple Inc.,Zacks Investment Ideas feature highlights: Apple,1715156940.0
AAPL,Apple Inc.,Apple’s China iPhone Shipments Soar 12% in March After Discounts,1715155748.0
AAPL,Apple Inc.,Stock buybacks hit highest level since 2018,1715155210.0
AAPL,Apple Inc.,Factbox-European regulators crack down on Big Tech,1715136946.0
ABCL,AbCellera Biologics Inc.,AbCellera Biologics Inc. (NASDAQ:ABCL) Q1 2024 Earnings Call Transcript,1715180639.0
ABCL,AbCellera Biologics Inc.,Q1 2024 Abcellera Biologics Inc Earnings Call,1715166067.0
ABCL,AbCellera Biologics Inc.,AbCellera Biologics (ABCL) Q1 2024 Earnings Call Transcript,1715157012.0
ACB,Aurora Cannabis Inc.,Aurora Marks First Shipment of Medical Cannabis to the New Zealand Market,1715166900.0
ACB,Aurora Cannabis Inc.,"Aurora Cannabis: Medical Market In Focus, Golden Cross Suggests Stock Uptrend Ahead Of Q1 Earnings",1715156280.0
ACB,Aurora Cannabis Inc.,Aurora Cannabis Expands to New Zealand Market,1715151000.0
ACB,Aurora Cannabis Inc.,Aurora Cannabis marks first shipment of medical cannabis to New Zealand market,1715149080.0
ACCD,"Accolade, Inc.","Commit To Purchase Accolade At $5, Earn 14.4% Annualized Using Options",1715165160.0
ACCD,"Accolade, Inc.","Accolade price target lowered by $4 at Guggenheim, here's why",1715147040.0
ACGL,Arch Capital Group Ltd.,Insider Sale: CEO of GLOBAL MORTGAGE GROUP at Arch Capital Group Ltd (ACGL) Sells Shares,1715170980.0
ACHC,"Acadia Healthcare Company, Inc.",Acadia and Geisinger break ground on Danville behavioural hospital,1715156491.0
ACMR,"ACM Research, Inc.","ACM Research, Inc. (ACMR) Q1 2024 Earnings Call Transcript",1715172668.0
ACMR,"ACM Research, Inc.",ACM Research Reports First Quarter 2024 Results,1715162400.0
ACMR,"ACM Research, Inc.","ACMR Stock Earnings: ACM Research Beats EPS, Beats Revenue for Q1 2024",1715162220.0
ACMR,"ACM Research, Inc.",ACM Research Expands Advanced Packaging Portfolio with Introduction of Frame Wafer Cleaning Tool,1715161800.0
ACMR,"ACM Research, Inc.",ACM Research Appoints David Kim as CEO of ACM Research Korea,1715161800.0
ACMR,"ACM Research, Inc.","ACM Research, Inc. 2024 Q1 - Results - Earnings Call Presentation",1715157808.0
ACMR,"ACM Research, Inc.",ACM Research Inc (ACMR) Q1 2024 Earnings: Substantial Revenue Growth and Profitability,1715151360.0
ACMR,"ACM Research, Inc.",ACM Research Outperforms Expectations with Strong Financials and Surge in Shipments: A Buy Rating,1715150760.0
ACMR,"ACM Research, Inc.","ACMR Korea gets new executive chief, advances packaging portfolio",1715145900.0
ACMR,"ACM Research, Inc.",ACM Research beats top-line and bottom-line estimates; reaffirms FY24 outlook,1715145540.0
ACMR,"ACM Research, Inc.","ACM Research still sees FY24 revenue $650M-$725M, consensus $699.36M",1715145420.0
ACMR,"ACM Research, Inc.","ACM Research reports Q1 non-GAAP EPS 52c, consensus 33c",1715145360.0
ADBE,Adobe Inc.,Adobe Revolutionizes Workplace Productivity with Launch of Acrobat AI Assistant for the Enterprise,1715173200.0
ADEA,Adeia Inc.,"Adeia First Quarter 2024 Earnings: Revenues Beat Expectations, EPS Lags",1715165455.0
ADPT,Adaptive Biotechnologies Corporation,"Analysts Offer Insights on Healthcare Companies: Adaptive Biotechnologies (ADPT), Veracyte (VCYT) and Nevro Corp (NVRO)",1715149260.0
ADPT,Adaptive Biotechnologies Corporation,"Analysts Offer Insights on Healthcare Companies: Clover Health Investments (CLOV), Cogent Biosciences (COGT) and Adaptive Biotechnologies (ADPT)",1715145060.0
ADPT,Adaptive Biotechnologies Corporation,"Adaptive Biotechnologies price target lowered by $3 at JPMorgan, here's why",1715144100.0
ADPT,Adaptive Biotechnologies Corporation,Adaptive Biotechnologies Corp (ADPT) Q1 2024 Earnings Call Transcript Highlights: Strategic ...,1715133300.0
ADSK,"Autodesk, Inc.","SHAREHOLDER ACTION ALERT: The Schall Law Firm Encourages Investors in Autodesk, Inc. with Losses to Contact the Firm",1715166071.0
ADSK,"Autodesk, Inc.","Levi & Korsinsky Announces the Filing of a Securities Class Action on Behalf of Autodesk, Inc.(ADSK) Shareholders",1715147180.0
ADSK,"Autodesk, Inc.",Autodesk : unveils Research Project Bernini for generative AI 3D shape creation,1715146627.0
ADSK,"Autodesk, Inc.",20 Best Business Ideas According To Reddit,1715127892.0
ADTN,"ADTRAN Holdings, Inc.",Q1 2024 ADTRAN Holdings Inc Earnings Call,1715142698.0
ADUS,Addus HomeCare Corporation,"The Zacks Analyst Blog Highlights DaVita,  Option Care Health, Addus HomeCare, Encompass Health and The Pennant",1715162340.0
ADUS,Addus HomeCare Corporation,Addus HomeCare Corp (ADUS) Q1 2024 Earnings Call Transcript Highlights: Strong Growth and ...,1715153040.0
AFRM,"Affirm Holdings, Inc.","Tesla probe, Reddit earnings, market outlook: Morning Brief",1715189013.0
AFRM,"Affirm Holdings, Inc.",Affirm Had a Great Quarter. Its Stock Is Tumbling ‘in Sympathy’ With Shopify.,1715188620.0
AFRM,"Affirm Holdings, Inc.",Affirm (AFRM) Q3 2024 Earnings Call Transcript,1715188513.0
AFRM,"Affirm Holdings, Inc.",The growth stocks under pressure after reporting earnings,1715182287.0
AFRM,"Affirm Holdings, Inc.",Affirm Earnings Top Views With Guidance Above Views. AFRM Stock Reverses Down.,1715180495.0
AFRM,"Affirm Holdings, Inc.",Affirm reports Q3 revenue jumping by 51% year over year,1715177041.0
AFRM,"Affirm Holdings, Inc.",Affirm Holdings (AFRM) Reports Q3 Earnings: What Key Metrics Have to Say,1715175028.0
AFRM,"Affirm Holdings, Inc.",Affirm’s Stock Is Rising. A Revenue Beat Is Just One of the Positives.,1715174280.0
AFRM,"Affirm Holdings, Inc.","Affirm Holdings (AFRM) Reports Q3 Loss, Tops Revenue Estimates",1715171703.0
AFRM,"Affirm Holdings, Inc.","Affirm Holdings, Inc. (AFRM) Q3 2024 Earnings Call Transcript",1715167215.0
AFRM,"Affirm Holdings, Inc.",Affirm Reports Third Fiscal Quarter 2024 Results,1715166000.0
AFRM,"Affirm Holdings, Inc.",Affirm Holdings: Fiscal Q3 Earnings Snapshot,1715153847.0
